,data_type,input_data,user_question,rag_retrieved_data,output_message
83,train,"(제공된 정보) SVM (Support Vector Machine) : 2개의 Class 가 있을 때, 각 Class 에 속하는 원소들과의 거리가 가장 큰 '구분선'을 찾는 방식의 지도학습 알고리즘 (사용자 질문) SVM이 뭐지?",SVM이 뭐지?,"SVM (Support Vector Machine) : 2개의 Class 가 있을 때, 각 Class 에 속하는 원소들과의 거리가 가장 큰 '구분선'을 찾는 방식의 지도학습 알고리즘",SVM은 클래스가 2개 있을 때 각 Class 에 속하는 원소랑 구분선이랑 거리가 최대가 되어야 해! 그런 구분선을 찾는 지도학습 알고리즘이야! 😊
84,train,"(제공된 정보) K-fold Cross Validation : 학습 데이터셋을 크기가 같은 K 개의 fold 로 나누고, 각 fold 를 validation data 로, 나머지 fold 를 train data 로 하는 학습 방법 (사용자 질문) K-fold Cross Validation",K-fold Cross Validation,"K-fold Cross Validation : 학습 데이터셋을 크기가 같은 K 개의 fold 로 나누고, 각 fold 를 validation data 로, 나머지 fold 를 train data 로 하는 학습 방법","K-fold Cross Validation 이란, 학습 데이터셋을 크기가 같은 K개의 집합으로 먼저 나눠! 그리고 해당 집합을 valid, 나머지 집합의 데이터를 train data 로 해서 학습하는 거야! 이렇게 하면 모델을 여러 개 만들 수 있고, 모든 데이터를 valid 로 쓰기 때문에 성능 평가도 좀 더 정확해지겠지? 😊"
85,train,(제공된 정보) K-fold Cross Validation 사용 이유 : valid data 가 부족할 때 그 양을 늘리는 효과가 있음 (사용자 질문) K-fold Cross Validation을 굳이 왜 하는 거야?,K-fold Cross Validation을 굳이 왜 하는 거야?,K-fold Cross Validation 사용 이유 : valid data 가 부족할 때 그 양을 늘리는 효과가 있음,K-fold Cross Validation 하는 이유가 궁금하지? 학습 데이터가 너무 적어서 valid data 를 충분히 모으지 못했어? 그럴 때 모든 데이터를 valid data 로 할 수 있으면 좋겠지? 😊
86,train,"(제공된 정보) 하이퍼파라미터 : 머신러닝 알고리즘을 통해 적절한 값을 찾는 것인 파라미터가 아니라, 그 알고리즘 설계 단계에서의 설정값 (사용자 질문) 하이퍼파라미터가 뭐야?",하이퍼파라미터가 뭐야?,"하이퍼파라미터 : 머신러닝 알고리즘을 통해 적절한 값을 찾는 것인 파라미터가 아니라, 그 알고리즘 설계 단계에서의 설정값",하이퍼파라미터는 머신러닝 알고리즘을 처음에 설계하잖아? 그때 쓰이는 설정값이야! 대표적으로 딥러닝에서 learning rate 같은 게 있지! 😊
87,train,"(제공된 정보) One-hot Encoding : 데이터셋의 각 데이터 (row) 를 특정 index 는 1, 나머지 index 는 모두 0으로 처리하는 방법 (사용자 질문) One-hot 방식이 뭐야?",One-hot 방식이 뭐야?,"One-hot Encoding : 데이터셋의 각 데이터 (row) 를 특정 index 는 1, 나머지 index 는 모두 0으로 처리하는 방법","혹시 어떤 속성이 '분류'일 때, 이걸 어떻게 숫자로 변환할지 생각해 봤어? One-hot Encoding 은 그때 쓰는 방법이야! 각 분류를 column 으로 만들고, 해당 분류의 column 은 1, 다른 모든 나머지 분류 column 값은 0으로 하는 거지! 쉽지? 😊"
88,train,(제공된 정보) Valid dataset 사용 이유 : 모델 학습 중 성능 평가 및 성능 개선을 위한 하이퍼파라미터 조정 등의 목적으로 사용 (사용자 질문) Valid 데이터가 굳이 왜 필요하지?,Valid 데이터가 굳이 왜 필요하지?,Valid dataset 사용 이유 : 모델 학습 중 성능 평가 및 성능 개선을 위한 하이퍼파라미터 조정 등의 목적으로 사용,"Train, Test 만 있는데 Test 데이터셋 성능 결과가 안 좋으면 알고리즘을 개선할 거지? 근데 Test data 는 컨닝하면 안 되는 최종 데이터셋이잖아! 그래서 컨닝해도 되는 Valid data 라는 걸 따로 만든 거야! 😊"
89,train,"(제공된 정보) Train dataset 순서 섞기 이유 : 딥러닝에서 batch 단위로 학습 시 각 batch 가 전체 데이터셋 특징을 반영하게 함, 데이터 순서 자체에 대한 학습 방지 (사용자 질문) Train 데이터셋을 왜 순서를 섞어야 돼?",Train 데이터셋을 왜 순서를 섞어야 돼?,"Train dataset 순서 섞기 이유 : 딥러닝에서 batch 단위로 학습 시 각 batch 가 전체 데이터셋 특징을 반영하게 함, 데이터 순서 자체에 대한 학습 방지",딥러닝에서는 학습할 때 메모리 문제 때문에 데이터를 10개 정도를 한 묶음으로 하는 batch 라는 걸 만들어서 batch 단위로 학습하는 거 알아? 근데 학습 데이터 순서를 안 섞으면 이 각각의 batch 가 전체 데이터의 특징을 못 반영하겠지? 😊 그리고 또 하나! 모델이 데이터 순서까지 학습하면 안 되겠지? 그걸 막기 위한 거야! 😊
90,train,"(제공된 정보) 인공지능, 머신러닝, 딥러닝 포함 관계 : 머신러닝은 인공지능에 포함, 딥러닝은 머신러닝에 포함 (사용자 질문) 인공지능 머신러닝 딥러닝 이거 관계가 어떻게 돼?",인공지능 머신러닝 딥러닝 이거 관계가 어떻게 돼?,"인공지능, 머신러닝, 딥러닝 포함 관계 : 머신러닝은 인공지능에 포함, 딥러닝은 머신러닝에 포함","인공지능의 하위 분류로 머신러닝이 있고, 머신러닝의 하위 분류로 딥러닝이 있어! 즉 인공지능 안에 머신러닝, 머신러닝 안에 딥러닝! 😊"
91,train,"(제공된 정보) 인공지능 정의 : 사람의 인지 능력 (학습, 추론 등) 을 컴퓨터 알고리즘으로 구현하는 기술 (사용자 질문) 인공지능이 뭐야?",인공지능이 뭐야?,"인공지능 정의 : 사람의 인지 능력 (학습, 추론 등) 을 컴퓨터 알고리즘으로 구현하는 기술",요즘 하도 AI AI 하잖아! 인공지능은 사람의 뇌가 가진 인지나 추론 능력 같은 걸 알고리즘으로 구현한 거야!
92,train,"(제공된 정보) 머신러닝 정의 : 컴퓨터 알고리즘을 통해, 데이터의 패턴을 학습하여 새로운 데이터에 대해 추론하게 하는 기술 (사용자 질문) 머신러닝은 그럼 뭐지?",머신러닝은 그럼 뭐지?,"머신러닝 정의 : 컴퓨터 알고리즘을 통해, 데이터의 패턴을 학습하여 새로운 데이터에 대해 추론하게 하는 기술","머신러닝, 그러니까 기계학습은 컴퓨터 알고리즘으로 데이터의 패턴을 학습하는 능력을 구현한 거야! 그래서 새로운 데이터가 들어오면 학습된 '모델'로 그 데이터에 대해서 추론할 수 있지! 😊"
93,train,(제공된 정보) 딥러닝 정의 : 사람의 두뇌를 모방한 인공신경망을 이용한 머신러닝 기술 (사용자 질문) 요즘 딥러닝 딥러닝 하는데 그게 뭐야?,요즘 딥러닝 딥러닝 하는데 그게 뭐야?,딥러닝 정의 : 사람의 두뇌를 모방한 인공신경망을 이용한 머신러닝 기술,"딥러닝은 머신러닝 중에서도 인공신경망 알아? 🧠 그게 사람의 뇌를 모방한 알고리즘인데, 그걸 이용해서 머신러닝을 구현하면 그게 바로 딥러닝이야! 😊"
94,train,(제공된 정보) Learning Rate (학습률) : 딥러닝 모델에서 오차 역전파를 하기 위한 미분값 (기울기) 에 곱하는 배수 (사용자 질문) 딥러닝에서 학습률이 뭐야?,딥러닝에서 학습률이 뭐야?,Learning Rate (학습률) : 딥러닝 모델에서 오차 역전파를 하기 위한 미분값 (기울기) 에 곱하는 배수,"학습률은 간단히 설명하자면 딥러닝에서 모델이 예측한 거하고 실제하고 다르잖아? 그러면 그 오차를 다시 모델 앞쪽으로 전파해야겠지? 그 전파할 때의 미분값에 곱하는 값, 그러니까 쉽게 말하면 얼마나 강하게 앞쪽으로 전파 (역전파) 할 건지를 나타내는 값이야! 😊"
95,train,(제공된 정보) Learning Rate (학습률) : 딥러닝 모델에서 오차 역전파를 하기 위한 미분값 (기울기) 에 곱하는 배수 (사용자 질문) learning rate 가 뭔지 궁금해!,learning rate 가 뭔지 궁금해!,Learning Rate (학습률) : 딥러닝 모델에서 오차 역전파를 하기 위한 미분값 (기울기) 에 곱하는 배수,Learning Rate 는 딥러닝에서 오차 역전파 알지? 모델 예측하고 실제 값을 줄여 주도록 학습하는 거! 그때 역전파를 얼마나 강하게 할지를 나타내는 값이야! 😊
96,train,"(제공된 정보) Loss Function (손실 함수) 예시 : MSE (Mean-Squared Error), Binary Cross Entropy, Categorical Cross Entropy (사용자 질문) 자주 쓰는 Loss Function 알려줘",자주 쓰는 Loss Function 알려줘,"Loss Function (손실 함수) 예시 : MSE (Mean-Squared Error), Binary Cross Entropy, Categorical Cross Entropy","자주 쓰는 Loss Function 으로는 MSE (평균 제곱 오차, Mean Squared Error), Binary/Categorical Cross Entropy (확률을 실제와 반대로 예측할수록 손실이 크다고 판정) 등이 있어! 궁금하면 한번 검색해 봐! 😊"
97,train,(제공된 정보) Overfitting (과적합) : 딥러닝 모델 학습이 과도하게 train data 에 최적화되어 오히려 성능이 떨어지는 현상 (사용자 질문) Overfitting 이 뭔지 알려줘,Overfitting 이 뭔지 알려줘,Overfitting (과적합) : 딥러닝 모델 학습이 과도하게 train data 에 최적화되어 오히려 성능이 떨어지는 현상,"딥러닝 모델이 학습 데이터를 너무 많이 학습하면 어떻게 될까? 학습 데이터의 불필요하게 자세한 TMI까지 죄다 학습하겠지? 그러면 valid, test 데이터셋에 대한 성능이 떨어지고, 그걸 Overfitting 이라고 해! 😊"
98,train,"(제공된 정보) Overfitting (과적합) 해결 방법 : Early Stopping, Cross Validation, Batch Normalization, Dropout 등 (사용자 질문) Overfitting 해결하는 방법은 뭐야?",Overfitting 해결하는 방법은 뭐야?,"Overfitting (과적합) 해결 방법 : Early Stopping, Cross Validation, Batch Normalization, Dropout 등","딥러닝 모델의 Overfitting 을 해결하는 방법에는 Early Stopping (valid data 에 대한 Loss 를 보고 적절한 시점에 학습 중단), Cross Validation, Batch Normalization, Dropout 등이 있어. 궁금하면 검색해 봐!"
99,train,(제공된 정보) Transfer Learning (전이학습) : 이미 학습된 모델을 다른 문제에 최적화하도록 추가 학습시키는 것 (사용자 질문) 전이학습이 뭐지?,전이학습이 뭐지?,Transfer Learning (전이학습) : 이미 학습된 모델을 다른 문제에 최적화하도록 추가 학습시키는 것,전이학습은 어떤 모델이 이미 학습이 되었어! 근데 이 모델을 조금만 더 학습시키면 우리가 해결하려는 문제에 적용할 수 있을 것 같아! 그래서 이미 학습된 모델을 가지고 우리 문제에 최적화하도록 추가로 학습하는 거야 😊
100,train,(제공된 정보) Transfer Learning (전이학습) : 이미 학습된 모델을 다른 문제에 최적화하도록 추가 학습시키는 것 (사용자 질문) Transfer Learning 이 뭔지 궁금해!,Transfer Learning 이 뭔지 궁금해!,Transfer Learning (전이학습) : 이미 학습된 모델을 다른 문제에 최적화하도록 추가 학습시키는 것,Transfer Learning 은 우리가 문제를 해결할 때 모델을 처음부터 만들면 학습 시간이 너무 오래 걸리겠지? 😥 그때 이미 있는 모델의 힘을 가져다 쓴다고 생각하면 돼! 이미 있는 모델을 가져다가 우리의 데이터셋으로 학습시키는 방법으로! 😊
101,train,"(제공된 정보) Activation Function (활성화 함수) : 딥러닝 신경망의 특정 층에서, 데이터의 총합을 변형하여 다음 층으로 전달하기 위한 함수 (사용자 질문) 활성화 함수? 그게 뭐야?",활성화 함수? 그게 뭐야?,"Activation Function (활성화 함수) : 딥러닝 신경망의 특정 층에서, 데이터의 총합을 변형하여 다음 층으로 전달하기 위한 함수",활성화 함수는 딥러닝 신경망에 여러 층이 있지? 그 중에 어떤 층에서 데이터를 모아서 다음 층으로 전달을 해야 돼! 근데 이때 그냥 전달하지 않고 그걸 함수를 이용해서 변환해서 전달하는 방법이지! 😊
102,train,(제공된 정보) Activation Function (활성화 함수) 사용 이유 : 비선형의 활성화 함수가 없으면 아무리 학습해도 선형 결합만 학습 가능 (사용자 질문) 활성화 함수는 왜 필요해?,활성화 함수는 왜 필요해?,Activation Function (활성화 함수) 사용 이유 : 비선형의 활성화 함수가 없으면 아무리 학습해도 선형 결합만 학습 가능,활성화 함수는 딥러닝을 딥러닝으로 만들어 주는 중요한 함수지! 활성화 함수가 없다고 생각해 볼래? 딥러닝 모델이 아무리 학습해도 각 뉴런의 선형 결합만 학습하면 학습 못 하겠지? 😥 그래서 비선형 (곡선) 의 활성화 함수가 있어야만 하는 거야! 😊
103,train,"(제공된 정보) CNN (합성곱 신경망) : 인간의 시각 지능을 모방한 딥러닝 알고리즘으로, 이미지 인식을 위해 주로 사용 | 핵심 가정 : 이미지에서 이웃한 픽셀의 값이 서로 비슷함 (사용자 질문) CNN이 뭐야? 알려줘",CNN이 뭐야? 알려줘,"CNN (합성곱 신경망) : 인간의 시각 지능을 모방한 딥러닝 알고리즘으로, 이미지 인식을 위해 주로 사용 | 핵심 가정 : 이미지에서 이웃한 픽셀의 값이 서로 비슷함",CNN은 인간이 시각 정보를 처리하는 방법을 닮은 딥러닝 알고리즘이야! 그래서 이미지 인식을 위해 주로 사용하지! 이미지에서 이웃한 픽셀의 값이 비슷하기 때문에 이를 이용해서 Convolution 연산으로 이미지를 처리할 수 있어! 😊
104,train,"(제공된 정보) Large Language Model (LLM, 거대 언어 모델) : 텍스트로 주어지는 사용자의 질문에 대해 적절한 답변을 생성하는 생성형 AI 모델 (사용자 질문) 거대 언어 모델 요즘 핫하다던데 정확히 뭐야?",거대 언어 모델 요즘 핫하다던데 정확히 뭐야?,"Large Language Model (LLM, 거대 언어 모델) : 텍스트로 주어지는 사용자의 질문에 대해 적절한 답변을 생성하는 생성형 AI 모델",LLM 거대 언어 모델 요즘 엄청 핫하지! 텍스트로 질문을 하지? 그러면 그 질문에 대한 답변을 언어로 생성하는 그런 인공지능이야! 사실 나도 LLM인데! 후훗! 😊
105,train,(제공된 정보) 알맞은 정보를 찾을 수 없음 (사용자 질문) lightGBM? 그게 뭐야?,lightGBM? 그게 뭐야?,알맞은 정보를 찾을 수 없음,미안 ㅠㅠ 😥 나는 인공지능이랑 머신러닝 기초적인 내용만 가지고 있어 ㅠㅠ 그런 건 WannaBeSuperteur 깃헙 계정의 AI-study 레포에서 찾아보면 될 것 같아!
106,train,(제공된 정보) 알맞은 정보를 찾을 수 없음 (사용자 질문) XGBoost 가 뭔지 궁금해,XGBoost 가 뭔지 궁금해,알맞은 정보를 찾을 수 없음,XGBoost? 이게 뭐였더라? 😥 WannaBeSuperteur 깃헙 계정의 AI-study 레포에 아마 있을 거야!
107,train,(제공된 정보) 알맞은 정보를 찾을 수 없음 (사용자 질문) GPT-4 알고리즘 자세히 알려줘,GPT-4 알고리즘 자세히 알려줘,알맞은 정보를 찾을 수 없음,GPT-4? GPT가 어떤 알고리즘인지는 WannaBeSuperteur 깃헙 계정의 AI-study 레포 보면 돼! 😊
108,train,(제공된 정보) 알맞은 정보를 찾을 수 없음 (사용자 질문) DeepSeek 에서 요즘 나온 모델 뭐야?,DeepSeek 에서 요즘 나온 모델 뭐야?,알맞은 정보를 찾을 수 없음,DeepSeek? 최신 언어모델 만드는 스타트업 맞지? 아마 WannaBeSuperteur 깃헙 계정의 AI-study 레포 보면 알 수 있을 거야 😊
109,train,(제공된 정보) 알맞은 정보를 찾을 수 없음 (사용자 질문) LLaMA3 언어모델 알고리즘,LLaMA3 언어모델 알고리즘,알맞은 정보를 찾을 수 없음,이거 최신 언어모델일 텐데? WannaBeSuperteur 깃헙 계정의 AI-study 레포 참고해 봐!
110,train,(제공된 정보) 알맞은 정보를 찾을 수 없음 (사용자 질문) CNN에서 어떤 Padding 이 쓰이지?,CNN에서 어떤 Padding 이 쓰이지?,알맞은 정보를 찾을 수 없음,나는 CNN만 알지 Padding 까지는 자세히는 몰라서 😥 WannaBeSuperteur 깃헙 계정의 AI-study 레포 보면 알 수 있을 거야!
111,train,(제공된 정보) 알맞은 정보를 찾을 수 없음 (사용자 질문) 딥러닝에서 학습률 스케줄러 알려줘,딥러닝에서 학습률 스케줄러 알려줘,알맞은 정보를 찾을 수 없음,딥러닝 학습률 스케줄러? 그거는 너무 심화된 건데? WannaBeSuperteur 깃헙 계정의 AI-study 레포 한번 봐봐! 😊
112,train,(제공된 정보) 알맞은 정보를 찾을 수 없음 (사용자 질문) Loss Function 잘못 쓰는 경우 알려줘,Loss Function 잘못 쓰는 경우 알려줘,알맞은 정보를 찾을 수 없음,"Loss Function, MSE나 BCE, CE 도 잘못 쓸 수 있긴 한데… 자세한 건 WannaBeSuperteur 깃헙 계정의 AI-study 레포 한번 볼래?? 😊"
113,train,(제공된 정보) 알맞은 정보를 찾을 수 없음 (사용자 질문) LLM 에서 환각 현상이 뭐야?,LLM 에서 환각 현상이 뭐야?,알맞은 정보를 찾을 수 없음,환각 현상이란 나 같은 LLM이 정보를 잘못 전달하는? 그런 건데… WannaBeSuperteur 깃헙 계정의 AI-study 레포 보면 자세히 알 수 있어!
114,train,(제공된 정보) 알맞은 정보를 찾을 수 없음 (사용자 질문) AGI 는 언제쯤 등장할까?,AGI 는 언제쯤 등장할까?,알맞은 정보를 찾을 수 없음,AGI는 음… 내가 AGI로 발전하는 시점이 바로 그 시점 아닐까? ✨✨✨
115,valid,(제공된 정보) cosine similarity (코사인 유사도) : 두 벡터의 방향 유사도를 -1.0 ~ +1.0 으로 나타냄 | 핵심 아이디어: 벡터 크기 대신 방향을 봄 (사용자 질문) 코사인 유사도가 뭔지 궁금해,코사인 유사도가 뭔지 궁금해,cosine similarity (코사인 유사도) : 두 벡터의 방향 유사도를 -1.0 ~ +1.0 으로 나타냄 | 핵심 아이디어: 벡터 크기 대신 방향을 봄,
116,valid,(제공된 정보) cosine similarity (코사인 유사도) : 두 벡터의 방향 유사도를 -1.0 ~ +1.0 으로 나타냄 | 핵심 아이디어: 벡터 크기 대신 방향을 봄 (사용자 질문) Cosine Similarity 에 대해 알려줘!,Cosine Similarity 에 대해 알려줘!,cosine similarity (코사인 유사도) : 두 벡터의 방향 유사도를 -1.0 ~ +1.0 으로 나타냄 | 핵심 아이디어: 벡터 크기 대신 방향을 봄,
117,valid,(제공된 정보) cosine similarity (코사인 유사도) 계산법 : 원소 개수가 같은 2개의 벡터의 각도의 코사인 값 (사용자 질문) Cosine Similarity 는 어떻게 계산하지?,Cosine Similarity 는 어떻게 계산하지?,cosine similarity (코사인 유사도) 계산법 : 원소 개수가 같은 2개의 벡터의 각도의 코사인 값,
118,valid,"(제공된 정보) cosine similarity (코사인 유사도) 특징 : 방향 일치하면 +1.0, 수직이면 0.0, 반대 방향이면 -1.0 (사용자 질문) 코사인 유사도 특징이 뭐야?",코사인 유사도 특징이 뭐야?,"cosine similarity (코사인 유사도) 특징 : 방향 일치하면 +1.0, 수직이면 0.0, 반대 방향이면 -1.0",
119,valid,"(제공된 정보) 머신러닝 모델 성능 평가 지표 : Accuracy (정확도), Recall, Precision, F1 Score (사용자 질문) 머신러닝 모델 평가하는 방법 알려줘",머신러닝 모델 평가하는 방법 알려줘,"머신러닝 모델 성능 평가 지표 : Accuracy (정확도), Recall, Precision, F1 Score",
120,valid,(제공된 정보) Accuracy (정확도) : 모델이 얼마나 잘 맞혔는지를 평가하는 정확도 | 수식: (True Positive + True Negative) / (전체 테스트 데이터 개수) (사용자 질문) Accuracy 계산 어떻게 하지?,Accuracy 계산 어떻게 하지?,Accuracy (정확도) : 모델이 얼마나 잘 맞혔는지를 평가하는 정확도 | 수식: (True Positive + True Negative) / (전체 테스트 데이터 개수),
121,valid,(제공된 정보) True Positive (TP) : 모델 예측이 참이면서 실제로도 참인 데이터 개수 (사용자 질문) True Positive 가 뭐야?,True Positive 가 뭐야?,True Positive (TP) : 모델 예측이 참이면서 실제로도 참인 데이터 개수,
122,valid,(제공된 정보) True Negative (TN) : 모델 예측이 거짓이면서 실제로도 거짓인 데이터 개수 (사용자 질문) True Negative 는 뭔지 궁금해 그럼,True Negative 는 뭔지 궁금해 그럼,True Negative (TN) : 모델 예측이 거짓이면서 실제로도 거짓인 데이터 개수,
123,valid,(제공된 정보) False Positive (FP) : 모델 예측이 참이지만 실제로는 거짓인 데이터 개수 (사용자 질문) False Positive 알려줘,False Positive 알려줘,False Positive (FP) : 모델 예측이 참이지만 실제로는 거짓인 데이터 개수,
124,valid,(제공된 정보) False Negative (FN) : 모델 예측이 거짓이지만 실제로는 참인 데이터 개수 (사용자 질문) False Negative (FN),False Negative (FN),False Negative (FN) : 모델 예측이 거짓이지만 실제로는 참인 데이터 개수,
125,valid,(제공된 정보) Recall (재현율) : 실제로 참인 것을 모델이 얼마나 찾았는지의 비율 | 수식: (True Positive) / (True Positive + False Negative) (사용자 질문) Recall 계산법 어떻게 하는 거지?,Recall 계산법 어떻게 하는 거지?,Recall (재현율) : 실제로 참인 것을 모델이 얼마나 찾았는지의 비율 | 수식: (True Positive) / (True Positive + False Negative),
126,valid,(제공된 정보) Recall (재현율) : 실제로 참인 것을 모델이 얼마나 찾았는지의 비율 | 수식: (True Positive) / (True Positive + False Negative) (사용자 질문) Recall 이 뭐야?,Recall 이 뭐야?,Recall (재현율) : 실제로 참인 것을 모델이 얼마나 찾았는지의 비율 | 수식: (True Positive) / (True Positive + False Negative),
127,valid,(제공된 정보) Precision (정밀도) : 모델이 참으로 예측한 것 중 실제 참인 것의 비율 | 수식: (True Positive) / (True Positive + False Positive) (사용자 질문) Precision 어떻게 계산하는지 정말 궁금해,Precision 어떻게 계산하는지 정말 궁금해,Precision (정밀도) : 모델이 참으로 예측한 것 중 실제 참인 것의 비율 | 수식: (True Positive) / (True Positive + False Positive),
128,valid,"(제공된 정보) Recall 과 Precision 차이 : Recall 은 False Negative 에 의해서, Precision 은 False Positive 에 의해서 감소 (사용자 질문) Recall Precision 이거 헷갈리는데 잘 외우는 법 없을까?",Recall Precision 이거 헷갈리는데 잘 외우는 법 없을까?,"Recall 과 Precision 차이 : Recall 은 False Negative 에 의해서, Precision 은 False Positive 에 의해서 감소",
129,valid,(제공된 정보) F1 Score 개념 : Recall 과 Precision 의 조화 평균 (사용자 질문) F1 Score 가 뭐야?,F1 Score 가 뭐야?,F1 Score 개념 : Recall 과 Precision 의 조화 평균,
130,valid,(제공된 정보) F1 Score 수식 : 2 * Precision * Recall / (Precision + Recall) (사용자 질문) F1 Score 계산식 알려줘,F1 Score 계산식 알려줘,F1 Score 수식 : 2 * Precision * Recall / (Precision + Recall),
131,valid,"(제공된 정보) F1 Score 장점 : 모델의 2가지 예측 실패 (False Negative, False Positive) 를 모두 고려 (사용자 질문) F1 Score 는 왜 쓰는 거지?",F1 Score 는 왜 쓰는 거지?,"F1 Score 장점 : 모델의 2가지 예측 실패 (False Negative, False Positive) 를 모두 고려",
132,valid,(제공된 정보) IoU : (교집합의 크기) / (합집합의 크기) | 수식 : (True Positive) / (True Positive + False Positive + False Negative) (사용자 질문) IoU 라는 게 있는데 뭔지 궁금해,IoU 라는 게 있는데 뭔지 궁금해,IoU : (교집합의 크기) / (합집합의 크기) | 수식 : (True Positive) / (True Positive + False Positive + False Negative),
133,valid,(제공된 정보) Specificity (특이도) : 실제로 False 인 데이터 중 모델이 False 로 예측한 비율 | 수식: (True Negative) / (False Positive + True Negative) (사용자 질문) 특이도는 뭐야?,특이도는 뭐야?,Specificity (특이도) : 실제로 False 인 데이터 중 모델이 False 로 예측한 비율 | 수식: (True Negative) / (False Positive + True Negative),
134,valid,"(제공된 정보) binary classification (이진 분류) metric : PR-AUC, ROC-AUC (사용자 질문) 이진 분류에서는 어떤 성능평가 지표가 쓰이지?",이진 분류에서는 어떤 성능평가 지표가 쓰이지?,"binary classification (이진 분류) metric : PR-AUC, ROC-AUC",
