,data_type,input_data,user_question,rag_retrieved_data,output_message
46,train,"(제공된 정보) Data Augmentation (데이터 증강) : 학습 데이터 부족, 데이터 불균형 해결 목적으로 학습 데이터에 기존과 유사한 데이터를 추가하여 늘리는 것 (사용자 질문) Augmentation 이 뭔지 알려줘",Augmentation 이 뭔지 알려줘,"Data Augmentation (데이터 증강) : 학습 데이터 부족, 데이터 불균형 해결 목적으로 학습 데이터에 기존과 유사한 데이터를 추가하여 늘리는 것","데이터 증강, 그러니까 Augmentation 은 학습 데이터에 기존 학습 데이터랑 비슷한 걸 추가해서 데이터를 늘리는 거야! 😊 데이터 불균형 해결에 딱이지!"
47,train,(제공된 정보) Undersampling 과 Oversampling : Undersampling은 데이터가 많은 Class 의 일부 데이터를 제거 | Oversampling 은 데이터가 적은 Class 의 데이터 증가 (사용자 질문) Undersampling 이랑 Oversampling 이 뭐야?,Undersampling 이랑 Oversampling 이 뭐야?,Undersampling 과 Oversampling : Undersampling은 데이터가 많은 Class 의 일부 데이터를 제거 | Oversampling 은 데이터가 적은 Class 의 데이터 증가,"Undersampling 은 데이터가 많은 Class 에서 일부 데이터를 제거하는 거고, Oversampling 은 데이터가 적은 Class 의 데이터를 늘리는 거야!"
48,train,(제공된 정보) Undersampling : 데이터가 많은 Class 의 일부 데이터를 제거 (사용자 질문) Undersampling 이 뭐지?,Undersampling 이 뭐지?,Undersampling : 데이터가 많은 Class 의 일부 데이터를 제거,Undersampling 은 데이터가 많은 Class 에서 일부 데이터를 제거해서 데이터 불균형을 줄이는 거야! 😊
49,train,(제공된 정보) Oversampling : 데이터가 적은 Class 의 데이터 증가 (사용자 질문) 그럼 Oversampling 은 뭐야?,그럼 Oversampling 은 뭐야?,Oversampling : 데이터가 적은 Class 의 데이터 증가,Oversampling 은 데이터가 적은 Class 에 있는 데이터 개수를 늘려서 불균형을 해소하는 거야! 😊
50,train,"(제공된 정보) Data Imbalance (데이터 불균형) 고려 성능지표 : F1 Score, AUROC, ROC-AUC (사용자 질문) 데이터 불균형을 고려한 성능지표를 추천해 줘!",데이터 불균형을 고려한 성능지표를 추천해 줘!,"Data Imbalance (데이터 불균형) 고려 성능지표 : F1 Score, AUROC, ROC-AUC","데이터 불균형을 고려할 수 있는 성능지표로는 F1 Score, AUROC, ROC-AUC 같은 것들이 있어! 궁금하면 물어봐!"
51,train,"(제공된 정보) Undersampling 방법 : Tomek Links (Class 경계선 상의 데이터 삭제), Random Sampling (랜덤 샘플링) (사용자 질문) Undersampling 하는 방법 알려줘",Undersampling 하는 방법 알려줘,"Undersampling 방법 : Tomek Links (Class 경계선 상의 데이터 삭제), Random Sampling (랜덤 샘플링)","Undersampling 방법으로는 랜덤하게 샘플링해서 일부 데이터만 뽑거나, Tomek Links 라고 해서 Class 간 경계선에 있는 데이터 중 Majority Class 에 해당하는 데이터를 삭제하는 방법도 있어! 😊"
52,train,(제공된 정보) Oversampling 방법 : SMOTE (Minority Class 데이터 2개의 벡터의 중간값 계산) (사용자 질문) Oversampling 방법은 어떤 게 있어?,Oversampling 방법은 어떤 게 있어?,Oversampling 방법 : SMOTE (Minority Class 데이터 2개의 벡터의 중간값 계산),"Oversampling 하는 방법으로는, SMOTE 라고 해서 Minority Class 의 데이터 중 2개를 벡터로 한 다음 그 벡터의 중간값, 그러니까 가중치 평균을 구하는 방법이 대표적이야! 😊"
53,train,"(제공된 정보) 차원의 저주 : 학습 데이터의 차원, 즉 feature 개수가 너무 많아서 학습에 문제가 발생하는 것 (사용자 질문) 차원의 저주가 뭐지?",차원의 저주가 뭐지?,"차원의 저주 : 학습 데이터의 차원, 즉 feature 개수가 너무 많아서 학습에 문제가 발생하는 것","차원의 저주 많이 들어 봤지? 그건 학습 데이터의 차원, 그러니까 feature 개수가 너무 많아져서 학습에 문제가 생기는 거야!"
54,train,"(제공된 정보) 차원의 저주의 문제점 : 계산량, 학습 시간, 메모리 사용량 증가, 성능 감소 (사용자 질문) 차원의 저주가 구체적으로 어떤 문제야?",차원의 저주가 구체적으로 어떤 문제야?,"차원의 저주의 문제점 : 계산량, 학습 시간, 메모리 사용량 증가, 성능 감소","일단 feature 가 불필요하게 많아져서 계산량이나 학습 시간, 메모리 사용량이 늘어나지! 그리고 불필요하게 많은 feature 를 학습하느라 모델 성능도 떨어질 수 있어 😥"
55,train,(제공된 정보) Decision Tree (의사결정 나무) : 학습 데이터의 feature 조건에 따라 가지치기를 하여 Tree 를 만드는 학습 방식 (사용자 질문) Decision Tree 가 뭔지 자세히 알고 싶어,Decision Tree 가 뭔지 자세히 알고 싶어,Decision Tree (의사결정 나무) : 학습 데이터의 feature 조건에 따라 가지치기를 하여 Tree 를 만드는 학습 방식,"Decision Tree 는 학습 데이터의 속성, 그러니까 feature의 값에 대해 조건을 걸고, 그 조건에 따라 가지치기를 해서 Tree 를 만드는 식으로 진행되는 학습 방식이야! 😊"
56,train,(제공된 정보) Decision Tree (의사결정 나무) : 학습 데이터의 feature 조건에 따라 가지치기를 하여 Tree 를 만드는 학습 방식 (사용자 질문) 의사결정 나무,의사결정 나무,Decision Tree (의사결정 나무) : 학습 데이터의 feature 조건에 따라 가지치기를 하여 Tree 를 만드는 학습 방식,"의사결정 나무는 학습 데이터의 feature 값에 따라 여러 가지 조건을 만들어서, 그 조건들을 기준으로 분기하는 '가지'를 만드는 식의 머신러닝 알고리즘이지!"
57,train,(제공된 정보) Decision Tree (의사결정 나무) 의 추론 : 입력 데이터가 주어졌을 때 학습된 조건에 따라 판단하는 것을 반복 (사용자 질문) Decision Tree 로 결정하는 방법은?,Decision Tree 로 결정하는 방법은?,Decision Tree (의사결정 나무) 의 추론 : 입력 데이터가 주어졌을 때 학습된 조건에 따라 판단하는 것을 반복,"입력 데이터가 주어지면, 그 데이터가 가지를 따라 이동하면서 학습된 조건들을 만나겠지? 그 조건에 맞는 가지로 이동하는 걸 계속 반복해서 끝에 도달하면 결론이 나오지! 😊"
58,train,(제공된 정보) Ensemble (앙상블) : 머신러닝에서 여러 알고리즘 또는 모델을 결합하여 학습하는 것 (사용자 질문) 앙상블이 뭔지 알려줘,앙상블이 뭔지 알려줘,Ensemble (앙상블) : 머신러닝에서 여러 알고리즘 또는 모델을 결합하여 학습하는 것,앙상블은 머신러닝을 할 때 여러 가지 알고리즘이나 모델을 조합해서 학습하는 방법을 말해!
59,train,(제공된 정보) Ensemble (앙상블) 장점 : 여러 개의 모델을 이용하여 단일 모델 이용 시보다 성능 향상 (사용자 질문) 앙상블을 왜 하는 거야?,앙상블을 왜 하는 거야?,Ensemble (앙상블) 장점 : 여러 개의 모델을 이용하여 단일 모델 이용 시보다 성능 향상,사람들도 성과를 높이려고 협업이라는 걸 하지? 👯‍♀️ 그렇듯이 머신러닝 모델도 여러 개를 쓰면 하나만 쓸 때보다 성능이 좋아지니까! 😊
60,train,"(제공된 정보) Ensemble (앙상블) 방법 : Voting (보팅), Bagging (배깅), Boosting (부스팅), Stacking (스태킹) (사용자 질문) 앙상블 하는 구체적인 방법 알려줘",앙상블 하는 구체적인 방법 알려줘,"Ensemble (앙상블) 방법 : Voting (보팅), Bagging (배깅), Boosting (부스팅), Stacking (스태킹)","앙상블은 크게 4가지 방법이 있어! Voting (보팅), Bagging (배깅), Boosting (부스팅), Stacking (스태킹) 이렇게! 😊"
61,train,"(제공된 정보) Ensemble (앙상블) 방법 : Voting (보팅), Bagging (배깅), Boosting (부스팅), Stacking (스태킹) (사용자 질문) 앙상블은 정확히 어떻게 하는 건지 궁금해",앙상블은 정확히 어떻게 하는 건지 궁금해,"Ensemble (앙상블) 방법 : Voting (보팅), Bagging (배깅), Boosting (부스팅), Stacking (스태킹)","사람들이 협업하는 법도 다양하듯이 앙상블 방법도 여러 가지지! Voting (보팅), Bagging (배깅), Boosting (부스팅), Stacking (스태킹)!"
62,train,(제공된 정보) Voting (보팅) : 여러 모델의 예측 결과를 종합하여 최종 결론 도출 (사용자 질문) 보팅에 대해 자세히 알려줘,보팅에 대해 자세히 알려줘,Voting (보팅) : 여러 모델의 예측 결과를 종합하여 최종 결론 도출,보팅은 여러 개의 머신러닝 모델들의 예측 결과를 조합해서 최종 결론을 도출하는 거야! 😊
63,train,(제공된 정보) Voting (보팅) : 여러 모델의 예측 결과를 종합하여 최종 결론 도출 (사용자 질문) 앙상블 중에 Voting 이 뭐야?,앙상블 중에 Voting 이 뭐야?,Voting (보팅) : 여러 모델의 예측 결과를 종합하여 최종 결론 도출,Voting 은 앙상블 방법 중에 가장 쉬운 거야! 여러 모델이 예측한 결과값들 있지? 그걸 조합하면 돼!
64,train,"(제공된 정보) Voting (보팅) 방법 : Hard Voting (다수결 투표), Soft Voting (예측 결과 평균) (사용자 질문) 보팅의 방법에는 구체적으로 뭐가 있지?",보팅의 방법에는 구체적으로 뭐가 있지?,"Voting (보팅) 방법 : Hard Voting (다수결 투표), Soft Voting (예측 결과 평균)","Hard Voting 과 Soft Voting 이 있지! 각각 다수결 투표하는 거, 그리고 모델들의 예측 결과를 평균 내는 거야!"
65,train,"(제공된 정보) Bagging (배깅) : 원본 데이터셋에서 랜덤 샘플링된 다수의 데이터셋을 각 모델로 학습, 해당 모델들의 결과 종합 (사용자 질문) Bagging 이 뭔지 궁금해",Bagging 이 뭔지 궁금해,"Bagging (배깅) : 원본 데이터셋에서 랜덤 샘플링된 다수의 데이터셋을 각 모델로 학습, 해당 모델들의 결과 종합",배깅은 데이터셋에서 랜덤하게 일부분을 샘플링하고 그 샘플링된 데이터로 모델을 학습시켜! 샘플링 다양하게 하면 모델 여러 개 나오겠지? 그럼 그 모델들의 예측 결과를 종합하는 거야! 어때? 멋진 방법이지? 😊
66,train,"(제공된 정보) Boosting (부스팅) : 랜덤 샘플링된 데이터셋 여러 개로 여러 개의 모델 학습, 직전 모델이 오답을 한 데이터의 가중치를 높여서 순차 학습 (사용자 질문) 그럼 Boosting 은 뭐야?",그럼 Boosting 은 뭐야?,"Boosting (부스팅) : 랜덤 샘플링된 데이터셋 여러 개로 여러 개의 모델 학습, 직전 모델이 오답을 한 데이터의 가중치를 높여서 순차 학습","Boosting 은 Bagging 처럼 랜덤 샘플링된 데이터로 모델 학습시키는 거야! 근데 이때 모델들을 순차적으로 학습하고, 직전 모델이 오답을 한 데이터를 오답 노트처럼 높은 가중치를 두는 게 특징이야! 😊"
67,train,"(제공된 정보) Stacking (스태킹) : 학습 데이터의 개별 모델들의 예측값을 입력, 실제 출력값을 출력하는 메타 모델을 만들고, 메타 모델 예측값을 최종 예측값으로 사용 (사용자 질문) Stacking 알려줘",Stacking 알려줘,"Stacking (스태킹) : 학습 데이터의 개별 모델들의 예측값을 입력, 실제 출력값을 출력하는 메타 모델을 만들고, 메타 모델 예측값을 최종 예측값으로 사용","Stacking 은 개별 모델의 예측값을 입력으로, 실제 출력값을 출력으로 하는 메타 모델을 학습한 다음! 그 메타 모델의 예측값을 최종 결과로 이용하는 방식이야! 😊"
68,train,(제공된 정보) Gaussian Mixture (가우시안 혼합) : 가우시안 분포 (정규분포) 의 혼합을 통해 데이터를 근사하는 머신러닝 알고리즘 (사용자 질문) Gaussian Mixture 모델이 뭐야?,Gaussian Mixture 모델이 뭐야?,Gaussian Mixture (가우시안 혼합) : 가우시안 분포 (정규분포) 의 혼합을 통해 데이터를 근사하는 머신러닝 알고리즘,"Gaussian Mixture 는 정규분포 알지? 그걸 가우시안 분포라고 하는데, 그 가우시안 분포의 혼합으로 데이터를 근사하는 거야!"
69,train,(제공된 정보) Gaussian Mixture (가우시안 혼합) : 가우시안 분포 (정규분포) 의 혼합을 통해 데이터를 근사하는 머신러닝 알고리즘 (사용자 질문) 가우시안 혼합이 뭔지 궁금해,가우시안 혼합이 뭔지 궁금해,Gaussian Mixture (가우시안 혼합) : 가우시안 분포 (정규분포) 의 혼합을 통해 데이터를 근사하는 머신러닝 알고리즘,가우시안 혼합은 정규분포 알지? 그걸 혼합시켜서 데이터를 근사하는 거야! 데이터 값에 대한 확률은 그 분포의 확률밀도함수의 합으로 표현할 수 있지! 😊
70,train,"(제공된 정보) K-means Clustering : 비지도학습 방법으로, 데이터를 K개의 클러스터 (집단) 으로 나누는 방법 (사용자 질문) K-means Clustering 이 뭐야?",K-means Clustering 이 뭐야?,"K-means Clustering : 비지도학습 방법으로, 데이터를 K개의 클러스터 (집단) 으로 나누는 방법",K-means Clustering 은 데이터를 클러스터 K개로 나누는 비지도학습 방법이야! 그러니까 AI가 센스있게 적당히 K개의 그룹으로 나누는 거지! 😊
71,train,"(제공된 정보) K-means Clustering 방법 : feature space 에서 K개의 점을 임의 지정 후, 각 data point 를 가장 가까운 점에 할당 -> K개의 각 점을 매칭되는 data point 의 값으로 갱신을 수렴할 때까지 반복 (사용자 질문) K-means Clustering 의 방법을 알려줘",K-means Clustering 의 방법을 알려줘,"K-means Clustering 방법 : feature space 에서 K개의 점을 임의 지정 후, 각 data point 를 가장 가까운 점에 할당 -> K개의 각 점을 매칭되는 data point 의 값으로 갱신을 수렴할 때까지 반복",K-means Clustering 은 먼저 feature space 에서 mean point라고 하는 점을 K개 정해! 그런 다음 각 data point 들을 이들 중 가장 가까운 점으로 할당하고! 그런 다음 이들 K개의 점을 그 점들에 할당된 data point 의 평균값으로 업데이트해! 😊 이걸 수렴할 때까지 무한 반복 🔁 하는 거야! 어렵지 않지?
72,train,"(제공된 정보) kNN (k-Nearest-Neighbor) : 어떤 data point 를 분류할 때, 가장 가까운 k개의 data point 의 Class 값 중 빈도가 가장 큰 Class 로 예측 (사용자 질문) kNN 에 대해 알려줘",kNN 에 대해 알려줘,"kNN (k-Nearest-Neighbor) : 어떤 data point 를 분류할 때, 가장 가까운 k개의 data point 의 Class 값 중 빈도가 가장 큰 Class 로 예측","kNN (k-Nearest-Neighbor) 알고리즘은 지도학습으로, 엄청 간단해! 😊😊 data point 를 분류할 때, 그 주변에 있는 가장 가까운 k개의 점을 찾아서 그것들의 Class 분포를 확인해! 그런 다음 다수결로 가장 많이 있는 Class로 예측하는 거야! 엄청 쉽지? 😊"
73,train,"(제공된 정보) kNN (k-Nearest-Neighbor) : 어떤 data point 를 분류할 때, 가장 가까운 k개의 data point 의 Class 값 중 빈도가 가장 큰 Class 로 예측 (사용자 질문) k Nearest Neighbor 알고리즘이 뭐야?",k Nearest Neighbor 알고리즘이 뭐야?,"kNN (k-Nearest-Neighbor) : 어떤 data point 를 분류할 때, 가장 가까운 k개의 data point 의 Class 값 중 빈도가 가장 큰 Class 로 예측","k-Nearest-Neighbor (kNN) 알고리즘은 지도학습 중에서 엄청 간단한 거야! Data point 가 어느 분류에 속하는지 예측할 때, 그냥 그 주변에 있는 가장 가까운 k개의 점들 중 다수결로 가장 많이 속하는 Class 로 예측하는 거야! 쉽지? 😊"
74,train,"(제공된 정보) 지도학습, 비지도학습, 강화학습 : 지도학습은 입력값 및 출력값을 학습 데이터로 하며, 출력값 (label) 필요 | 비지도학습은 출력값 (label) 이 없는 방식의 학습 | 강화학습은 AI 모델이 환경에서 어떤 행동을 하고, 그 보상을 받아서 보상을 최대화하는 방식의 학습 (사용자 질문) 지도학습 비지도학습 이런 게 뭐야?",지도학습 비지도학습 이런 게 뭐야?,"지도학습, 비지도학습, 강화학습 : 지도학습은 입력값 및 출력값을 학습 데이터로 하며, 출력값 (label) 필요 | 비지도학습은 출력값 (label) 이 없는 방식의 학습 | 강화학습은 AI 모델이 환경에서 어떤 행동을 하고, 그 보상을 받아서 보상을 최대화하는 방식의 학습","먼저 지도학습은 입력이랑 출력이 있어! 어떤 입력에 대해서 어떤 출력을 해라 하고 지시하는 거지! 비지도학습은 출력 없이 입력만으로 학습해! 그리고 강화학습은 모델이 환경에서 행동을 하면 보상을 받는데, 그 보상을 최대화하는 식으로 작동하는 거야!"
75,train,"(제공된 정보) 지도학습, 비지도학습, 강화학습 : 지도학습은 입력값 및 출력값을 학습 데이터로 하며, 출력값 (label) 필요 | 비지도학습은 출력값 (label) 이 없는 방식의 학습 | 강화학습은 AI 모델이 환경에서 어떤 행동을 하고, 그 보상을 받아서 보상을 최대화하는 방식의 학습 (사용자 질문) 머신러닝도 여러 가지가 있는데 그게 뭔지 알려줘",머신러닝도 여러 가지가 있는데 그게 뭔지 알려줘,"지도학습, 비지도학습, 강화학습 : 지도학습은 입력값 및 출력값을 학습 데이터로 하며, 출력값 (label) 필요 | 비지도학습은 출력값 (label) 이 없는 방식의 학습 | 강화학습은 AI 모델이 환경에서 어떤 행동을 하고, 그 보상을 받아서 보상을 최대화하는 방식의 학습",지도학습이랑 비지도학습 먼저 설명할게! 지도학습은 입력에 대해 출력을 예측하는 거라서 입출력이 모두 있는데 비지도학습은 입력만 있고 출력은 없어! 뭔지 느낌 알지? 강화학습은 AI가 어떤 환경에서 보상 값이 최대화되는 행동을 하도록 최적화하는 알고리즘이야!
76,train,"(제공된 정보) 지도학습, 비지도학습, 강화학습 : 지도학습은 입력값 및 출력값을 학습 데이터로 하며, 출력값 (label) 필요 | 비지도학습은 출력값 (label) 이 없는 방식의 학습 | 강화학습은 AI 모델이 환경에서 어떤 행동을 하고, 그 보상을 받아서 보상을 최대화하는 방식의 학습 (사용자 질문) 강화학습? 지도학습? 그게 뭐지?",강화학습? 지도학습? 그게 뭐지?,"지도학습, 비지도학습, 강화학습 : 지도학습은 입력값 및 출력값을 학습 데이터로 하며, 출력값 (label) 필요 | 비지도학습은 출력값 (label) 이 없는 방식의 학습 | 강화학습은 AI 모델이 환경에서 어떤 행동을 하고, 그 보상을 받아서 보상을 최대화하는 방식의 학습",지도학습은 어떤 입력에 대해 출력값이 지도자 (선생님) 역할을 해서 그 출력값 예측과 실제 출력값의 오차를 줄이도록 학습하는 거야! 비지도학습은 출력값 없이 입력만으로 AI가 센스있게 학습하는 거고! 강화학습은 조금 복잡하긴 한데 간단히 말하자면 AI가 어떤 환경에서 행동을 해. 그러면 보상을 받아. 그 보상을 최대화하도록 하는 '정책'을 학습하는 거야! 이제 좀 이해되지? 😊
77,train,"(제공된 정보) 지도학습과 비지도학습의 차이 : 지도학습은 모델이 입력 값에 대해 특정 출력을 하도록 학습시키기 위한 출력값 (label) 이 있지만, 비지도학습은 출력값이 없음 (사용자 질문) 지도학습과 비지도학습의 차이가 뭐야?",지도학습과 비지도학습의 차이가 뭐야?,"지도학습과 비지도학습의 차이 : 지도학습은 모델이 입력 값에 대해 특정 출력을 하도록 학습시키기 위한 출력값 (label) 이 있지만, 비지도학습은 출력값이 없음",지도학습은 모델이 어떤 입력이 주어지면 그 입력에 대해 수학 함수처럼 mapping 시켜서 출력을 뱉어내지? 그 출력값의 예측과 실제 값의 오차를 줄이도록 학습하는 거야! 근데 비지도학습은 그런 출력값 없이 AI가 알아서 잘 딱 깔끔하고 센스있게 배우는 거지! 😊
78,train,"(제공된 정보) Classification (분류) 및 Regression (회귀) : Classification 문제는 대상의 Class 를 분류 (예: 개, 고양이, 뱀) 하는 것 | Regression 문제는 연속적인 숫자 값 (예: 강수량) 을 예측하는 것 (사용자 질문) 머신러닝으로 해결해야 하는 문제의 종류를 알려줘",머신러닝으로 해결해야 하는 문제의 종류를 알려줘,"Classification (분류) 및 Regression (회귀) : Classification 문제는 대상의 Class 를 분류 (예: 개, 고양이, 뱀) 하는 것 | Regression 문제는 연속적인 숫자 값 (예: 강수량) 을 예측하는 것","머신러닝으로 해결할 수 있는 문제에는 분류 (Classification) 랑 회귀 (Regression) 가 있어! 분류는 말 그대로 대상을 개, 고양이처럼 분류하는 문제고, 회귀는 어떤 연속적인 숫자 값을 예측하는 거야! 😊"
79,train,"(제공된 정보) Classification (분류) 및 Regression (회귀) : Classification 문제는 대상의 Class 를 분류 (예: 개, 고양이, 뱀) 하는 것 | Regression 문제는 연속적인 숫자 값 (예: 강수량) 을 예측하는 것 (사용자 질문) 분류와 회귀 문제가 뭐야?",분류와 회귀 문제가 뭐야?,"Classification (분류) 및 Regression (회귀) : Classification 문제는 대상의 Class 를 분류 (예: 개, 고양이, 뱀) 하는 것 | Regression 문제는 연속적인 숫자 값 (예: 강수량) 을 예측하는 것",분류는 어떤 대상이 어떤 종류에 속하는지 말 그대로 분류하는 거야! 회귀는 연속적인 숫자 값 강수량 같은 거 있지? 그걸 예측하는 거고! 😊
80,train,"(제공된 정보) Classification (분류) 및 Regression (회귀) : Classification 문제는 대상의 Class 를 분류 (예: 개, 고양이, 뱀) 하는 것 | Regression 문제는 연속적인 숫자 값 (예: 강수량) 을 예측하는 것 (사용자 질문) Regression 이랑 Classification 이 뭐지?",Regression 이랑 Classification 이 뭐지?,"Classification (분류) 및 Regression (회귀) : Classification 문제는 대상의 Class 를 분류 (예: 개, 고양이, 뱀) 하는 것 | Regression 문제는 연속적인 숫자 값 (예: 강수량) 을 예측하는 것","Regression (회귀) 은 연속적인 숫자 값을 보다 정확히 예측하는 머신러닝 모델을 만드는 문제고, Classification (분류) 는 대상을 개, 고양이🐶🐱 등으로 분류한 결과를 예측하는 모델을 만드는 거야! 😊"
81,train,"(제공된 정보) Naïve Bayes : 확률 기반 지도학습 분류 모델 | 핵심 아이디어: 각 Class 별 (전체 데이터 중 해당 Class 의 비율) x (새로운 데이터의 각 특징 조건 별 해당 Class 의 데이터의 비율의 곱) 을 계산하고, 그 값이 가장 큰 Class 로 예측 (사용자 질문) Naïve Bayes 가 뭔지 알려줘",Naïve Bayes 가 뭔지 알려줘,"Naïve Bayes : 확률 기반 지도학습 분류 모델 | 핵심 아이디어: 각 Class 별 (전체 데이터 중 해당 Class 의 비율) x (새로운 데이터의 각 특징 조건 별 해당 Class 의 데이터의 비율의 곱) 을 계산하고, 그 값이 가장 큰 Class 로 예측",Naïve Bayes 는 확률 기반으로 동작하는 지도학습 알고리즘이야! 각 Class 별로 먼저 전체 데이터에서 해당 Class가 몇 퍼센트인지를 구해! 그런 다음 여기에 새로운 데이터의 각 특징 있지? 어떤 단어를 포함한다든지. 그런 각 특징별로 그런 특징이 있는 데이터 중 해당 Class 의 데이터의 비율을 여기에 곱해. 그러면 '총 곱'이 나오겠지? 이 '총 곱'이 가장 큰 Class 로 예측하는 거야! 😊
82,train,"(제공된 정보) SVM (Support Vector Machine) : 2개의 Class 가 있을 때, 각 Class 에 속하는 원소들과의 거리가 가장 큰 '구분선'을 찾는 방식의 지도학습 알고리즘 (사용자 질문) 서포트 벡터 머신이 뭐야?",서포트 벡터 머신이 뭐야?,"SVM (Support Vector Machine) : 2개의 Class 가 있을 때, 각 Class 에 속하는 원소들과의 거리가 가장 큰 '구분선'을 찾는 방식의 지도학습 알고리즘","서포트 벡터 머신 (Support Vector Machine) 은 클래스가 2개 있을 때, 각 클래스에 속하는 원소들이 있겠지? 그 원소들이랑 다른 클래스에 속하는 원소들의 구분선을 만들어! 이때 이 구분선이랑 각 Class 원소랑 거리를 최대화하는 식의 알고리즘이지!"
