,data_type,input_data,user_question,rag_retrieved_data,output_message
0,train,(제공된 정보) cosine similarity (코사인 유사도) : 두 벡터의 방향 유사도를 -1.0 ~ +1.0 으로 나타냄 | 핵심 아이디어: 벡터 크기 대신 방향을 봄 (사용자 질문) cosine similarity가 뭐야?,cosine similarity가 뭐야?,cosine similarity (코사인 유사도) : 두 벡터의 방향 유사도를 -1.0 ~ +1.0 으로 나타냄 | 핵심 아이디어: 벡터 크기 대신 방향을 봄,코사인 유사도는 두 벡터의 방향이 비슷한지를 -1.0 ~ +1.0 의 값으로 나타낸 거야! 벡터 크기 대신 방향을 중요하게 보는 것이 핵심 아이디어지! 😊
1,train,(제공된 정보) cosine similarity (코사인 유사도) : 두 벡터의 방향 유사도를 -1.0 ~ +1.0 으로 나타냄 | 핵심 아이디어: 벡터 크기 대신 방향을 봄 (사용자 질문) 코사인 유사도가 뭐야?,코사인 유사도가 뭐야?,cosine similarity (코사인 유사도) : 두 벡터의 방향 유사도를 -1.0 ~ +1.0 으로 나타냄 | 핵심 아이디어: 벡터 크기 대신 방향을 봄,코사인 유사도는 두 벡터가 있을 때 그 벡터의 크기는 안 보고 방향이 비슷한지만 보는 값이야! -1.0 ~ +1.0 사이로 나타내지!
2,train,(제공된 정보) cosine similarity (코사인 유사도) 계산법 : 원소 개수가 같은 2개의 벡터의 각도의 코사인 값 (사용자 질문) 코사인 유사도 계산법 알려줘,코사인 유사도 계산법 알려줘,cosine similarity (코사인 유사도) 계산법 : 원소 개수가 같은 2개의 벡터의 각도의 코사인 값,"차원, 즉 원소 개수가 같은 2개의 벡터에 대해 그 각도의 코사인 값을 구하면 돼!"
3,train,"(제공된 정보) cosine similarity (코사인 유사도) 특징 : 방향 일치하면 +1.0, 수직이면 0.0, 반대 방향이면 -1.0 (사용자 질문) 코사인 유사도의 특징을 알려줘",코사인 유사도의 특징을 알려줘,"cosine similarity (코사인 유사도) 특징 : 방향 일치하면 +1.0, 수직이면 0.0, 반대 방향이면 -1.0","코사인 유사도는 서로 방향이 일치하면 +1.0, 수직이면 0.0, 정반대 방향이면 -1.0의 값을 가져! 😊"
4,train,"(제공된 정보) 머신러닝 모델 성능 평가 지표 : Accuracy (정확도), Recall, Precision, F1 Score (사용자 질문) 머신러닝에서 많이 쓰이는 평가지표 알려줘",머신러닝에서 많이 쓰이는 평가지표 알려줘,"머신러닝 모델 성능 평가 지표 : Accuracy (정확도), Recall, Precision, F1 Score","머신러닝 모델의 성능을 평가할 때는 Accuracy (정확도), Recall, Precision, F1 Score 같은 것이 대표적으로 사용돼!"
5,train,(제공된 정보) Accuracy (정확도) : 모델이 얼마나 잘 맞혔는지를 평가하는 정확도 | 수식: (True Positive + True Negative) / (전체 테스트 데이터 개수) (사용자 질문) Accuracy 는 어떻게 계산해?,Accuracy 는 어떻게 계산해?,Accuracy (정확도) : 모델이 얼마나 잘 맞혔는지를 평가하는 정확도 | 수식: (True Positive + True Negative) / (전체 테스트 데이터 개수),Accuracy 는 말 그대로 모델이 얼마나 잘 맞혔는지를 평가하는 정확도야! (True Positive + True Negative) / (전체 테스트 데이터 개수) 로 계산해!
6,train,(제공된 정보) True Positive (TP) : 모델 예측이 참이면서 실제로도 참인 데이터 개수 (사용자 질문) True Positive 같은 건 뭐야?,True Positive 같은 건 뭐야?,True Positive (TP) : 모델 예측이 참이면서 실제로도 참인 데이터 개수,True Positive (TP) 는 모델이 참으로 예측했으면서 실제로도 참인 데이터 개수!
7,train,(제공된 정보) True Negative (TN) : 모델 예측이 거짓이면서 실제로도 거짓인 데이터 개수 (사용자 질문) True Negative 는?,True Negative 는?,True Negative (TN) : 모델 예측이 거짓이면서 실제로도 거짓인 데이터 개수,True Negative (TN) 는 True Positive 와는 반대로 모델이 거짓으로 예측했는데 실제로도 거짓인 것의 개수야! 😊
8,train,(제공된 정보) False Positive (FP) : 모델 예측이 참이지만 실제로는 거짓인 데이터 개수 (사용자 질문) False Positive 는 뭐지 그럼?,False Positive 는 뭐지 그럼?,False Positive (FP) : 모델 예측이 참이지만 실제로는 거짓인 데이터 개수,False Positive (FP) 는 모델은 참이라고 예측했지만 실제로는 거짓인 데이터를 의미해!
9,train,(제공된 정보) False Negative (FN) : 모델 예측이 거짓이지만 실제로는 참인 데이터 개수 (사용자 질문) False Negative 는 뭐야 그러면?,False Negative 는 뭐야 그러면?,False Negative (FN) : 모델 예측이 거짓이지만 실제로는 참인 데이터 개수,False Negative (FN) 은 False Positive 와는 반대로 모델은 거짓이라고 추측했지만 실제로는 참인 데이터야!
10,train,(제공된 정보) Recall (재현율) : 실제로 참인 것을 모델이 얼마나 찾았는지의 비율 | 수식: (True Positive) / (True Positive + False Negative) (사용자 질문) Recall 은 어떻게 계산해?,Recall 은 어떻게 계산해?,Recall (재현율) : 실제로 참인 것을 모델이 얼마나 찾았는지의 비율 | 수식: (True Positive) / (True Positive + False Negative),Recall 은 실제로 참인 것을 모델이 얼마나 많이 찾았는지를 나타내는 것으로 (True Positive) / (True Positive + False Negative) 로 계산해!
11,train,(제공된 정보) Recall (재현율) : 실제로 참인 것을 모델이 얼마나 찾았는지의 비율 | 수식: (True Positive) / (True Positive + False Negative) (사용자 질문) Recall 은 뭐야?,Recall 은 뭐야?,Recall (재현율) : 실제로 참인 것을 모델이 얼마나 찾았는지의 비율 | 수식: (True Positive) / (True Positive + False Negative),Recall 은 모델이 실제로 Positive 인 데이터를 얼마나 많이 찾았는지를 나타내는 비율이야! 😊 (True Positive) / (True Positive + False Negative) 로 계산하지!
12,train,(제공된 정보) Precision (정밀도) : 모델이 참으로 예측한 것 중 실제 참인 것의 비율 | 수식: (True Positive) / (True Positive + False Positive) (사용자 질문) Precision 은 어떻게 계산하지,Precision 은 어떻게 계산하지,Precision (정밀도) : 모델이 참으로 예측한 것 중 실제 참인 것의 비율 | 수식: (True Positive) / (True Positive + False Positive),"Precision 은 모델이 참으로 예측한 것 중에 실제로 참인 것의 비율로, (True Positive) / (True Positive + False Positive) 로 계산하면 돼! 😊"
13,train,"(제공된 정보) Recall 과 Precision 차이 : Recall 은 False Negative 에 의해서, Precision 은 False Positive 에 의해서 감소 (사용자 질문) Recall 과 Precision 이 자꾸 헷갈리네",Recall 과 Precision 이 자꾸 헷갈리네,"Recall 과 Precision 차이 : Recall 은 False Negative 에 의해서, Precision 은 False Positive 에 의해서 감소","Recall 은 False Negative 에 의해 떨어지고, Precision 은 False Positive 에 의해 떨어진다고 생각하면 기억하기 쉬울걸? 😊"
14,train,(제공된 정보) F1 Score 개념 : Recall 과 Precision 의 조화 평균 (사용자 질문) F1 이 뭔지 알려줘,F1 이 뭔지 알려줘,F1 Score 개념 : Recall 과 Precision 의 조화 평균,F1 Score 는 Recall 과 Precision 의 조화 평균값이야! 😊
15,train,(제공된 정보) F1 Score 수식 : 2 * Precision * Recall / (Precision + Recall) (사용자 질문) F1 Score 구하는 수식을 알려줘,F1 Score 구하는 수식을 알려줘,F1 Score 수식 : 2 * Precision * Recall / (Precision + Recall),F1 Score = 2 * Precision * Recall / (Precision + Recall) 로 계산하면 돼! 이때 둘 중 하나가 0일 수도 있으니까 개발할 때는 조심하고! 😊
16,train,"(제공된 정보) F1 Score 장점 : 모델의 2가지 예측 실패 (False Negative, False Positive) 를 모두 고려 (사용자 질문) F1 Score 장점이 뭐야?",F1 Score 장점이 뭐야?,"F1 Score 장점 : 모델의 2가지 예측 실패 (False Negative, False Positive) 를 모두 고려",F1 Score 는 모델이 예측을 실패한 2가지 경우인 False Negative 와 False Positive 를 모두 고려한다는 게 장점이지! 😊
17,train,(제공된 정보) IoU : (교집합의 크기) / (합집합의 크기) | 수식 : (True Positive) / (True Positive + False Positive + False Negative) (사용자 질문) IoU 가 뭔지 알려줘,IoU 가 뭔지 알려줘,IoU : (교집합의 크기) / (합집합의 크기) | 수식 : (True Positive) / (True Positive + False Positive + False Negative),IoU 는 (교집합의 크기) / (합집합의 크기) 개념으로 수식으로는 True Positive / (True Positive + False Positive + False Negative) 로 구하면 돼! 😊
18,train,(제공된 정보) Specificity (특이도) : 실제로 False 인 데이터 중 모델이 False 로 예측한 비율 | 수식: (True Negative) / (False Positive + True Negative) (사용자 질문) 특이도라는 걸 봤는데 그게 뭔지 궁금해!,특이도라는 걸 봤는데 그게 뭔지 궁금해!,Specificity (특이도) : 실제로 False 인 데이터 중 모델이 False 로 예측한 비율 | 수식: (True Negative) / (False Positive + True Negative),특이도는 실제로 False 인 데이터 중 모델이 False 로 예측한 것의 비율이야!
19,train,"(제공된 정보) binary classification (이진 분류) metric : PR-AUC, ROC-AUC (사용자 질문) 이진 분류에서 쓰이는 Metric 을 알려줘!",이진 분류에서 쓰이는 Metric 을 알려줘!,"binary classification (이진 분류) metric : PR-AUC, ROC-AUC",이진 분류에서만 쓸 수 있는 Metric 에는 PR-AUC 와 ROC-AUC 가 있어! 자세히 알려줄까? 😊
20,train,"(제공된 정보) PR-AUC 와 ROC-AUC : PR-AUC는 x축이 recall, y축이 precision 일 때, ROC-AUC는 x축이 False Positive Rate, y축이 True Positive Rate 일 때 이 측정값들을 연결한 그래프 아래쪽의 넓이 (사용자 질문) PR-AUC랑 ROC-AUC가 뭐야?",PR-AUC랑 ROC-AUC가 뭐야?,"PR-AUC 와 ROC-AUC : PR-AUC는 x축이 recall, y축이 precision 일 때, ROC-AUC는 x축이 False Positive Rate, y축이 True Positive Rate 일 때 이 측정값들을 연결한 그래프 아래쪽의 넓이","PR-AUC는 x축을 recall, y축을 precision이라고 했을 때 이 측정값들을 연결한 그래프 아래쪽 넓이야! ROC-AUC는 x축을 False Positive Rate, y축을 True Positive Rate 로 했을 때 그걸 연결한 그래프 아래쪽의 넓이고!"
21,train,"(제공된 정보) PR-AUC : x축이 recall, y축이 precision 일 때 이 측정값들을 연결한 그래프 아래쪽의 넓이 (1에 가까울수록 성능 좋음) (사용자 질문) PR-AUC가 뭔지 자세히 알려줘!",PR-AUC가 뭔지 자세히 알려줘!,"PR-AUC : x축이 recall, y축이 precision 일 때 이 측정값들을 연결한 그래프 아래쪽의 넓이 (1에 가까울수록 성능 좋음)","PR-AUC는 x축은 recall, y축은 precision으로 했을 때 recall이 커지면 precision이 작아지잖아? 그 측정값들을 연결한 그래프 아래쪽 넓이야! 값이 커서 1에 가까울수록 성능이 좋지!"
22,train,"(제공된 정보) ROC-AUC : x축이 False Positive Rate, y축이 True Positive Rate 일 때 이 측정값들을 연결한 그래프 아래쪽의 넓이 (1에 가까울수록 성능 좋음) (사용자 질문) ROC-AUC가 뭔지 아주 자세히 알려줘",ROC-AUC가 뭔지 아주 자세히 알려줘,"ROC-AUC : x축이 False Positive Rate, y축이 True Positive Rate 일 때 이 측정값들을 연결한 그래프 아래쪽의 넓이 (1에 가까울수록 성능 좋음)","ROC-AUC는 x축을 False Positive Rate, y축을 True Positive Rate 라고 했을 때 x가 커질수록 y가 커지지? 근데 모델 성능이 좋으면 x=0 에 가까울 때도 y=1에 가까우니까, 그 아래쪽 넓이로 측정하는 거야! 넓이가 1에 가깝게 커질수록 성능이 좋지! 😊"
23,train,(제공된 정보) True Positive Rate : recall 의 다른 이름 (사용자 질문) True Positive Rate 가 뭐야? 궁금해!,True Positive Rate 가 뭐야? 궁금해!,True Positive Rate : recall 의 다른 이름,True Positive Rate 는 recall 의 다른 이름이야! 😊
24,train,(제공된 정보) False Positive Rate : 실제 Negative 인 것들 중 모델이 Positive 로 예측한 비율 | 수식: (False Positive) / (False Positive + True Negative) (사용자 질문) False Positive Rate 는 뭐지 그러면?,False Positive Rate 는 뭐지 그러면?,False Positive Rate : 실제 Negative 인 것들 중 모델이 Positive 로 예측한 비율 | 수식: (False Positive) / (False Positive + True Negative),False Positive Rate 는 False Positive / (False Positive + True Negative) 로 계산하지! 실제 Negative 인 것들 중 모델이 Positive 로 예측한 비율이야! 😊
25,train,"(제공된 정보) Confusion Matrix (혼동 행렬) : 모델의 예측 중 True Positive, True Negative, False Positive, False Negative 의 개수와 Recall, Precision 을 알기 쉽게 나타낸 표 (사용자 질문) Confusion Matrix 가 뭐야?",Confusion Matrix 가 뭐야?,"Confusion Matrix (혼동 행렬) : 모델의 예측 중 True Positive, True Negative, False Positive, False Negative 의 개수와 Recall, Precision 을 알기 쉽게 나타낸 표","Confusion Matrix 는 모델의 예측 중 True Positive, True Negative, False Positive, False Negative 의 개수와 Recall, Precision 을 알기 쉽게 나타낸 표야! 😊"
26,train,"(제공된 정보) Confusion Matrix (혼동 행렬) 작성 방법 : 첫 행은 '실제 값 = True', '실제 값 = False', 'Precision', 첫 열에는 '예측 = True', '예측 = False', 'Recall' 순서로 쓴 후 각 값을 계산 (사용자 질문) Confusion Matrix 만드는 법을 알려줘",Confusion Matrix 만드는 법을 알려줘,"Confusion Matrix (혼동 행렬) 작성 방법 : 첫 행은 '실제 값 = True', '실제 값 = False', 'Precision', 첫 열에는 '예측 = True', '예측 = False', 'Recall' 순서로 쓴 후 각 값을 계산","첫 행에는 '실제 값 = True', '실제 값 = False', 'Precision' 을 순서대로 쓰고, 첫 열에는 '예측 = True', '예측 = False', 'Recall' 순서대로 쓴 다음 각 값을 계산하면 빠르게 만들 수 있어! 😊"
27,train,"(제공된 정보) 불량품 예측에서의 Recall, Precision 사용 : Recall 은 불량품을 모델이 불량품으로 검출한 비율 | 해당 비율이 낮으면 불량품 검출 성능이 떨어짐을 의미 (사용자 질문) 실제 산업에서 불량품을 Positive 라고 하면 Precision, Recall 중 뭐가 더 중요해?","실제 산업에서 불량품을 Positive 라고 하면 Precision, Recall 중 뭐가 더 중요해?","불량품 예측에서의 Recall, Precision 사용 : Recall 은 불량품을 모델이 불량품으로 검출한 비율 | 해당 비율이 낮으면 불량품 검출 성능이 떨어짐을 의미",정답은 Recall! 😊 이건 불량품을 실제로 모델이 불량품으로 검출한 비율인데 이게 낮으면 불량품을 제대로 찾을 수 없다는 뜻이니까 문제가 되지!
28,train,"(제공된 정보) Normalization (정규화) : 데이터를 모델이 학습할 수 있도록 일정한 규칙에 따라 값을 변환하는 것 | 데이터 전처리에서 필수적 | 예시: min-max, z-score (사용자 질문) Normalization 이 뭐야?",Normalization 이 뭐야?,"Normalization (정규화) : 데이터를 모델이 학습할 수 있도록 일정한 규칙에 따라 값을 변환하는 것 | 데이터 전처리에서 필수적 | 예시: min-max, z-score",Normalization (정규화) 는 데이터를 머신러닝 모델이 잘 학습할 수 있도록 일정한 규칙에 따라 값을 변환해 주는 거야! 😊
29,train,"(제공된 정보) Normalization (정규화) : 데이터를 모델이 학습할 수 있도록 일정한 규칙에 따라 값을 변환하는 것 | 데이터 전처리에서 필수적 | 예시: min-max, z-score (사용자 질문) 정규화가 뭔지 궁금해",정규화가 뭔지 궁금해,"Normalization (정규화) : 데이터를 모델이 학습할 수 있도록 일정한 규칙에 따라 값을 변환하는 것 | 데이터 전처리에서 필수적 | 예시: min-max, z-score","정규화는 데이터 전처리에서 필수적인 방법 중 하나로, 데이터를 일정한 수식으로 변환하는 거야! 😊 대표적으로 min-max, z-score 정규화가 있지!"
30,train,(제공된 정보) Min-max normalization (Min-max 정규화) : 데이터의 최솟값과 최댓값을 기준으로 정규화 | 수식: y = (x - MIN) / (MAX - MIN) (사용자 질문) min-max 정규화가 뭐야?,min-max 정규화가 뭐야?,Min-max normalization (Min-max 정규화) : 데이터의 최솟값과 최댓값을 기준으로 정규화 | 수식: y = (x - MIN) / (MAX - MIN),min-max 정규화는 데이터를 최댓값과 최솟값을 이용해서 0~1 사이로 정규화하는 거야! 수식으로는 (x - MIN) / (MAX - MIN) 이지! 😊
31,train,(제공된 정보) Z score normalization (Z score 정규화) : 데이터를 평균과 표준편차를 이용한 Z score 값으로 정규화 | 수식: y = (x - MEAN) / STD (사용자 질문) Z score normalization 이 뭐지?,Z score normalization 이 뭐지?,Z score normalization (Z score 정규화) : 데이터를 평균과 표준편차를 이용한 Z score 값으로 정규화 | 수식: y = (x - MEAN) / STD,"Z score 정규화는 데이터를 평균과 표준편차를 이용해서 정규분포로 바꾸는 거야! 수식은 (x - MEAN) / STD, 즉 (x - 평균) / (표준편차) 야!"
32,train,"(제공된 정보) Clipping : 데이터를 특정 범위의 값에 속하도록 변환하는 것 (x > MAX 인 경우 MAX, x < MIN 인 경우 MIN 으로 변환) (사용자 질문) Clipping 에 대해서 자세히 알려줘",Clipping 에 대해서 자세히 알려줘,"Clipping : 데이터를 특정 범위의 값에 속하도록 변환하는 것 (x > MAX 인 경우 MAX, x < MIN 인 경우 MIN 으로 변환)","Clipping 은 주어진 데이터를 최솟값 미만이면 최솟값으로, 최댓값 이상이면 최댓값으로 만들어서 어떤 범위 내에 있도록 만들어 주는 거야! 😊"
33,train,(제공된 정보) Clipping 장점 : Outlier 의 영향을 잘 받지 않음 (사용자 질문) Clipping 을 하면 뭐가 좋아?,Clipping 을 하면 뭐가 좋아?,Clipping 장점 : Outlier 의 영향을 잘 받지 않음,Clipping 을 하면 주어진 데이터를 범위 내로 옮겨주기 때문에 outlier 도 그 범위 내로 옮겨져서 그 영향이 덜하지!
34,train,(제공된 정보) Log Scaling : 주어진 데이터 x를 log(x) 또는 log(1+x) 값으로 변환하는 것 (사용자 질문) 로그 스케일링이 뭐야?,로그 스케일링이 뭐야?,Log Scaling : 주어진 데이터 x를 log(x) 또는 log(1+x) 값으로 변환하는 것,Log Scaling 은 주어진 데이터 x를 log(x) 나 log(x + 1) 로 변환하는 거야! 😊
35,train,(제공된 정보) Outlier (이상치) : 데이터셋에서 일반적인 분포 범위를 크게 벗어난 데이터 (사용자 질문) Outlier 가 뭔지 궁금해,Outlier 가 뭔지 궁금해,Outlier (이상치) : 데이터셋에서 일반적인 분포 범위를 크게 벗어난 데이터,"Outlier 는 이상치라고도 하는데, 데이터셋에서 일반적인 데이터 분포를 크게 벗어나는 데이터를 말하는 거야!"
36,train,(제공된 정보) Outlier (이상치) : 데이터셋에서 일반적인 분포 범위를 크게 벗어난 데이터 (사용자 질문) 이상치가 뭔지 궁금해,이상치가 뭔지 궁금해,Outlier (이상치) : 데이터셋에서 일반적인 분포 범위를 크게 벗어난 데이터,이상치는 데이터셋에서 일반적인 범위를 크게 벗어나는 값들을 말하지! 😊
37,train,(제공된 정보) Outlier (이상치) 제거 이유 : 데이터 시각화 결과의 가독성 향상 및 머신러닝 학습에 지장이 없게 함 (사용자 질문) Outlier 를 제거해야 하는 이유는 뭐지?,Outlier 를 제거해야 하는 이유는 뭐지?,Outlier (이상치) 제거 이유 : 데이터 시각화 결과의 가독성 향상 및 머신러닝 학습에 지장이 없게 함,"Outlier 가 있으면 데이터를 시각화했을 때 가독성이 떨어지고, 머신러닝 학습할 때 문제가 생길 수도 있어 😥"
38,train,"(제공된 정보) Outlier (이상치) 제거 방법 : 상자 수염 그림 이용, 평균 및 표준편차 이용 등 (사용자 질문) Outlier 를 제거하는 방법에 대해 알려줘",Outlier 를 제거하는 방법에 대해 알려줘,"Outlier (이상치) 제거 방법 : 상자 수염 그림 이용, 평균 및 표준편차 이용 등","Outlier 를 제거하기 위해서는 상자 수염 그림을 그렸을 때 범위를 벗어나는 값을 찾거나, 평균과 표준편차를 이용해서 z 값이 너무 크거나 작은 값을 찾으면 돼! 😊"
39,train,"(제공된 정보) PCA (주성분 분석) : Principal Component Analysis 라고 하며, 데이터셋의 분산을 최대한 보존하는 특징의 결합을 추출 (사용자 질문) PCA 가 뭐야?",PCA 가 뭐야?,"PCA (주성분 분석) : Principal Component Analysis 라고 하며, 데이터셋의 분산을 최대한 보존하는 특징의 결합을 추출","PCA 는 Principal Compnent Analysis 라고 해서, 데이터셋에서 분산을 최대한 보존하는 특징들을 조합해서 그걸 추출하는 거야!"
40,train,"(제공된 정보) PCA (주성분 분석) : Principal Component Analysis 라고 하며, 데이터셋의 분산을 최대한 보존하는 특징의 결합을 추출 (사용자 질문) 주성분 분석이 뭐지?",주성분 분석이 뭐지?,"PCA (주성분 분석) : Principal Component Analysis 라고 하며, 데이터셋의 분산을 최대한 보존하는 특징의 결합을 추출","주성분 분석 (PCA, Principal Component Analysis) 는 주성분, 즉 데이터셋에서 분산을 최대한 보존할 수 있는 특징들의 조합을 찾는 방법이야!"
41,train,(제공된 정보) PCA (주성분 분석) 사용 이유 : 데이터 압축 및 차원 축소 목적 (사용자 질문) PCA 는 왜 하는 거지 그러면?,PCA 는 왜 하는 거지 그러면?,PCA (주성분 분석) 사용 이유 : 데이터 압축 및 차원 축소 목적,데이터를 압축하고 차원을 축소해서 머신러닝 모델이 핵심 속성들만 더 잘 학습할 수 있게 하기 위해서지! 😊
42,train,(제공된 정보) Data Imbalance (데이터 불균형) : Classification Task 에서 Class 간 데이터 개수가 유의미하게 차이 나는 것 (사용자 질문) 데이터 불균형이 뭔지 알려줘,데이터 불균형이 뭔지 알려줘,Data Imbalance (데이터 불균형) : Classification Task 에서 Class 간 데이터 개수가 유의미하게 차이 나는 것,데이터 불균형은 Classification Task (분류 문제) 에서 각 Class 간 데이터 개수가 유의미하게 차이가 날 때 그걸 말하는 거야!
43,train,"(제공된 정보) Data Imbalance (데이터 불균형) 해결 방법 : 데이터를 새로 추가/제거하거나, 학습 환경만 바꾸는 방법 (사용자 질문) 데이터 불균형 해결하는 법이 뭐야?",데이터 불균형 해결하는 법이 뭐야?,"Data Imbalance (데이터 불균형) 해결 방법 : 데이터를 새로 추가/제거하거나, 학습 환경만 바꾸는 방법","데이터 불균형을 해결하려면 데이터를 새로 추가 또는 제거할 수도 있고, 그게 어렵다면 성능 평가 지표 같은 학습 환경을 바꿔도 돼!"
44,train,"(제공된 정보) Data Imbalance (데이터 불균형) 데이터 추가/제거 : Minority Class 데이터 추가 수집, Data Augmentation, Undersampling, Oversampling 등 (사용자 질문) 데이터를 새로 추가하거나 제거하는 법 알려줘",데이터를 새로 추가하거나 제거하는 법 알려줘,"Data Imbalance (데이터 불균형) 데이터 추가/제거 : Minority Class 데이터 추가 수집, Data Augmentation, Undersampling, Oversampling 등","데이터 불균형을 해결하기 위해서 데이터를 추가하거나 제거하려면 데이터 개수가 적은 Minority Class 데이터를 늘리거나, Data Augmentation (증강) 하거나, 아니면 Undersampling, Oversampling 을 할 수도 있어! 😊"
45,train,"(제공된 정보) Data Imbalance (데이터 불균형) 학습 환경 변경 : 적절한 성능 평가 지표 선택, Loss Function 에서 Class 별 가중치 조정 (사용자 질문) 그러면 학습 환경만 바꾸는 방법은 뭐야?",그러면 학습 환경만 바꾸는 방법은 뭐야?,"Data Imbalance (데이터 불균형) 학습 환경 변경 : 적절한 성능 평가 지표 선택, Loss Function 에서 Class 별 가중치 조정","성능 평가 지표를 F1 Score, PR-AUC, ROC-AUC 등 데이터 불균형을 고려할 수 있는 걸로 선택하거나, Loss Function 알지? 거기에서 Class 별 Loss 가중치를 데이터가 적은 Class 일수록 높게 하면 돼! 😊"
