,data_type,input_data,user_question,rag_retrieved_data,output_message
135,valid,"(제공된 정보) PR-AUC 와 ROC-AUC : PR-AUC는 x축이 recall, y축이 precision 일 때, ROC-AUC는 x축이 False Positive Rate, y축이 True Positive Rate 일 때 이 측정값들을 연결한 그래프 아래쪽의 넓이 (사용자 질문) PR-AUC, ROC-AUC 가 뭐야?","PR-AUC, ROC-AUC 가 뭐야?","PR-AUC 와 ROC-AUC : PR-AUC는 x축이 recall, y축이 precision 일 때, ROC-AUC는 x축이 False Positive Rate, y축이 True Positive Rate 일 때 이 측정값들을 연결한 그래프 아래쪽의 넓이",
136,valid,"(제공된 정보) PR-AUC : x축이 recall, y축이 precision 일 때 이 측정값들을 연결한 그래프 아래쪽의 넓이 (1에 가까울수록 성능 좋음) (사용자 질문) PR-AUC 에 대해 아주 자세히 알려줘",PR-AUC 에 대해 아주 자세히 알려줘,"PR-AUC : x축이 recall, y축이 precision 일 때 이 측정값들을 연결한 그래프 아래쪽의 넓이 (1에 가까울수록 성능 좋음)",
137,valid,"(제공된 정보) ROC-AUC : x축이 False Positive Rate, y축이 True Positive Rate 일 때 이 측정값들을 연결한 그래프 아래쪽의 넓이 (1에 가까울수록 성능 좋음) (사용자 질문) ROC-AUC 는 뭔지 정말 궁금해",ROC-AUC 는 뭔지 정말 궁금해,"ROC-AUC : x축이 False Positive Rate, y축이 True Positive Rate 일 때 이 측정값들을 연결한 그래프 아래쪽의 넓이 (1에 가까울수록 성능 좋음)",
138,valid,(제공된 정보) True Positive Rate : recall 의 다른 이름 (사용자 질문) True Positive Rate 구하는 방법을 알려줘,True Positive Rate 구하는 방법을 알려줘,True Positive Rate : recall 의 다른 이름,
139,valid,(제공된 정보) False Positive Rate : 실제 Negative 인 것들 중 모델이 Positive 로 예측한 비율 | 수식: (False Positive) / (False Positive + True Negative) (사용자 질문) False Positive Rate 가 뭔지 정말 궁금하다,False Positive Rate 가 뭔지 정말 궁금하다,False Positive Rate : 실제 Negative 인 것들 중 모델이 Positive 로 예측한 비율 | 수식: (False Positive) / (False Positive + True Negative),
140,valid,"(제공된 정보) Confusion Matrix (혼동 행렬) : 모델의 예측 중 True Positive, True Negative, False Positive, False Negative 의 개수와 Recall, Precision 을 알기 쉽게 나타낸 표 (사용자 질문) Confusion Matrix (혼동 행렬) 이 뭐야?",Confusion Matrix (혼동 행렬) 이 뭐야?,"Confusion Matrix (혼동 행렬) : 모델의 예측 중 True Positive, True Negative, False Positive, False Negative 의 개수와 Recall, Precision 을 알기 쉽게 나타낸 표",
141,valid,"(제공된 정보) Confusion Matrix (혼동 행렬) 작성 방법 : 첫 행은 '실제 값 = True', '실제 값 = False', 'Precision', 첫 열에는 '예측 = True', '예측 = False', 'Recall' 순서로 쓴 후 각 값을 계산 (사용자 질문) Confusion Matrix 는 그럼 어떻게 만들어?",Confusion Matrix 는 그럼 어떻게 만들어?,"Confusion Matrix (혼동 행렬) 작성 방법 : 첫 행은 '실제 값 = True', '실제 값 = False', 'Precision', 첫 열에는 '예측 = True', '예측 = False', 'Recall' 순서로 쓴 후 각 값을 계산",
142,valid,"(제공된 정보) 불량품 예측에서의 Recall, Precision 사용 : Recall 은 불량품을 모델이 불량품으로 검출한 비율 | 해당 비율이 낮으면 불량품 검출 성능이 떨어짐을 의미 (사용자 질문) 불량품 최소화해야 하면 불량이 Positive 일 때 Recall 이랑 Precision 중에 뭐가 더 좋지?",불량품 최소화해야 하면 불량이 Positive 일 때 Recall 이랑 Precision 중에 뭐가 더 좋지?,"불량품 예측에서의 Recall, Precision 사용 : Recall 은 불량품을 모델이 불량품으로 검출한 비율 | 해당 비율이 낮으면 불량품 검출 성능이 떨어짐을 의미",
143,valid,"(제공된 정보) Normalization (정규화) : 데이터를 모델이 학습할 수 있도록 일정한 규칙에 따라 값을 변환하는 것 | 데이터 전처리에서 필수적 | 예시: min-max, z-score (사용자 질문) Normalization 정규화 그게 뭐야?",Normalization 정규화 그게 뭐야?,"Normalization (정규화) : 데이터를 모델이 학습할 수 있도록 일정한 규칙에 따라 값을 변환하는 것 | 데이터 전처리에서 필수적 | 예시: min-max, z-score",
144,valid,"(제공된 정보) Normalization (정규화) : 데이터를 모델이 학습할 수 있도록 일정한 규칙에 따라 값을 변환하는 것 | 데이터 전처리에서 필수적 | 예시: min-max, z-score (사용자 질문) 정규화가 뭐지? 정말 궁금해!",정규화가 뭐지? 정말 궁금해!,"Normalization (정규화) : 데이터를 모델이 학습할 수 있도록 일정한 규칙에 따라 값을 변환하는 것 | 데이터 전처리에서 필수적 | 예시: min-max, z-score",
145,valid,(제공된 정보) Min-max normalization (Min-max 정규화) : 데이터의 최솟값과 최댓값을 기준으로 정규화 | 수식: y = (x - MIN) / (MAX - MIN) (사용자 질문) Min-Max 정규화가 뭔지 잘 모르겠어,Min-Max 정규화가 뭔지 잘 모르겠어,Min-max normalization (Min-max 정규화) : 데이터의 최솟값과 최댓값을 기준으로 정규화 | 수식: y = (x - MIN) / (MAX - MIN),
146,valid,(제공된 정보) Z score normalization (Z score 정규화) : 데이터를 평균과 표준편차를 이용한 Z score 값으로 정규화 | 수식: y = (x - MEAN) / STD (사용자 질문) Z 스코어 정규화가 뭐야?,Z 스코어 정규화가 뭐야?,Z score normalization (Z score 정규화) : 데이터를 평균과 표준편차를 이용한 Z score 값으로 정규화 | 수식: y = (x - MEAN) / STD,
147,valid,"(제공된 정보) Clipping : 데이터를 특정 범위의 값에 속하도록 변환하는 것 (x > MAX 인 경우 MAX, x < MIN 인 경우 MIN 으로 변환) (사용자 질문) Clipping? 클리핑? 그게 뭐지?",Clipping? 클리핑? 그게 뭐지?,"Clipping : 데이터를 특정 범위의 값에 속하도록 변환하는 것 (x > MAX 인 경우 MAX, x < MIN 인 경우 MIN 으로 변환)",
148,valid,(제공된 정보) Clipping 장점 : Outlier 의 영향을 잘 받지 않음 (사용자 질문) 클리핑 이거 쓸데없이 하는 거 아니야?,클리핑 이거 쓸데없이 하는 거 아니야?,Clipping 장점 : Outlier 의 영향을 잘 받지 않음,
149,valid,(제공된 정보) Log Scaling : 주어진 데이터 x를 log(x) 또는 log(1+x) 값으로 변환하는 것 (사용자 질문) 로그 스케일링도 정규화 같은데 뭐야?,로그 스케일링도 정규화 같은데 뭐야?,Log Scaling : 주어진 데이터 x를 log(x) 또는 log(1+x) 값으로 변환하는 것,
150,valid,(제공된 정보) Outlier (이상치) : 데이터셋에서 일반적인 분포 범위를 크게 벗어난 데이터 (사용자 질문) Outlier 개념,Outlier 개념,Outlier (이상치) : 데이터셋에서 일반적인 분포 범위를 크게 벗어난 데이터,
151,valid,(제공된 정보) Outlier (이상치) : 데이터셋에서 일반적인 분포 범위를 크게 벗어난 데이터 (사용자 질문) 이상치가 뭐야?,이상치가 뭐야?,Outlier (이상치) : 데이터셋에서 일반적인 분포 범위를 크게 벗어난 데이터,
152,valid,(제공된 정보) Outlier (이상치) 제거 이유 : 데이터 시각화 결과의 가독성 향상 및 머신러닝 학습에 지장이 없게 함 (사용자 질문) Outlier 없애야 되는 이유가 뭐야?,Outlier 없애야 되는 이유가 뭐야?,Outlier (이상치) 제거 이유 : 데이터 시각화 결과의 가독성 향상 및 머신러닝 학습에 지장이 없게 함,
153,valid,"(제공된 정보) Outlier (이상치) 제거 방법 : 상자 수염 그림 이용, 평균 및 표준편차 이용 등 (사용자 질문) Outlier 없애려면 어떻게 해야 되지?",Outlier 없애려면 어떻게 해야 되지?,"Outlier (이상치) 제거 방법 : 상자 수염 그림 이용, 평균 및 표준편차 이용 등",
154,valid,"(제공된 정보) PCA (주성분 분석) : Principal Component Analysis 라고 하며, 데이터셋의 분산을 최대한 보존하는 특징의 결합을 추출 (사용자 질문) PCA에 대해 알려줘",PCA에 대해 알려줘,"PCA (주성분 분석) : Principal Component Analysis 라고 하며, 데이터셋의 분산을 최대한 보존하는 특징의 결합을 추출",
155,valid,"(제공된 정보) PCA (주성분 분석) : Principal Component Analysis 라고 하며, 데이터셋의 분산을 최대한 보존하는 특징의 결합을 추출 (사용자 질문) 주성분 분석?",주성분 분석?,"PCA (주성분 분석) : Principal Component Analysis 라고 하며, 데이터셋의 분산을 최대한 보존하는 특징의 결합을 추출",
156,valid,(제공된 정보) PCA (주성분 분석) 사용 이유 : 데이터 압축 및 차원 축소 목적 (사용자 질문) PCA 그거 왜 하는 건지 모르겠어,PCA 그거 왜 하는 건지 모르겠어,PCA (주성분 분석) 사용 이유 : 데이터 압축 및 차원 축소 목적,
157,valid,(제공된 정보) Data Imbalance (데이터 불균형) : Classification Task 에서 Class 간 데이터 개수가 유의미하게 차이 나는 것 (사용자 질문) 데이터가 불균형하다고? 그게 뭐지,데이터가 불균형하다고? 그게 뭐지,Data Imbalance (데이터 불균형) : Classification Task 에서 Class 간 데이터 개수가 유의미하게 차이 나는 것,
158,valid,"(제공된 정보) Data Imbalance (데이터 불균형) 해결 방법 : 데이터를 새로 추가/제거하거나, 학습 환경만 바꾸는 방법 (사용자 질문) 데이터 불균형 어떻게 하면 해결할 수 있지?",데이터 불균형 어떻게 하면 해결할 수 있지?,"Data Imbalance (데이터 불균형) 해결 방법 : 데이터를 새로 추가/제거하거나, 학습 환경만 바꾸는 방법",
159,valid,"(제공된 정보) Data Imbalance (데이터 불균형) 데이터 추가/제거 : Minority Class 데이터 추가 수집, Data Augmentation, Undersampling, Oversampling 등 (사용자 질문) 그러면 데이터 추가 제거해서 불균형 어떻게 해결해?",그러면 데이터 추가 제거해서 불균형 어떻게 해결해?,"Data Imbalance (데이터 불균형) 데이터 추가/제거 : Minority Class 데이터 추가 수집, Data Augmentation, Undersampling, Oversampling 등",
160,valid,"(제공된 정보) Data Imbalance (데이터 불균형) 학습 환경 변경 : 적절한 성능 평가 지표 선택, Loss Function 에서 Class 별 가중치 조정 (사용자 질문) 학습 환경만 바꾸는 방법도 알려줘",학습 환경만 바꾸는 방법도 알려줘,"Data Imbalance (데이터 불균형) 학습 환경 변경 : 적절한 성능 평가 지표 선택, Loss Function 에서 Class 별 가중치 조정",
161,valid,"(제공된 정보) Data Augmentation (데이터 증강) : 학습 데이터 부족, 데이터 불균형 해결 목적으로 학습 데이터에 기존과 유사한 데이터를 추가하여 늘리는 것 (사용자 질문) 데이터 증강이 뭐지?",데이터 증강이 뭐지?,"Data Augmentation (데이터 증강) : 학습 데이터 부족, 데이터 불균형 해결 목적으로 학습 데이터에 기존과 유사한 데이터를 추가하여 늘리는 것",
162,valid,(제공된 정보) Undersampling 과 Oversampling : Undersampling은 데이터가 많은 Class 의 일부 데이터를 제거 | Oversampling 은 데이터가 적은 Class 의 데이터 증가 (사용자 질문) 언더샘플링이랑 오버샘플링이 뭔지 궁금해,언더샘플링이랑 오버샘플링이 뭔지 궁금해,Undersampling 과 Oversampling : Undersampling은 데이터가 많은 Class 의 일부 데이터를 제거 | Oversampling 은 데이터가 적은 Class 의 데이터 증가,
163,valid,(제공된 정보) Undersampling : 데이터가 많은 Class 의 일부 데이터를 제거 (사용자 질문) Undersampling 에 대해서 알려줘,Undersampling 에 대해서 알려줘,Undersampling : 데이터가 많은 Class 의 일부 데이터를 제거,
164,valid,(제공된 정보) Oversampling : 데이터가 적은 Class 의 데이터 증가 (사용자 질문) oversampling 이 뭐지?,oversampling 이 뭐지?,Oversampling : 데이터가 적은 Class 의 데이터 증가,
165,valid,"(제공된 정보) Data Imbalance (데이터 불균형) 고려 성능지표 : F1 Score, AUROC, ROC-AUC (사용자 질문) 데이터 불균형 생각해서 어떤 성능지표 할지 추천해 줘",데이터 불균형 생각해서 어떤 성능지표 할지 추천해 줘,"Data Imbalance (데이터 불균형) 고려 성능지표 : F1 Score, AUROC, ROC-AUC",
166,valid,"(제공된 정보) Undersampling 방법 : Tomek Links (Class 경계선 상의 데이터 삭제), Random Sampling (랜덤 샘플링) (사용자 질문) undersampling 방법은 뭐가 있어?",undersampling 방법은 뭐가 있어?,"Undersampling 방법 : Tomek Links (Class 경계선 상의 데이터 삭제), Random Sampling (랜덤 샘플링)",
167,valid,(제공된 정보) Oversampling 방법 : SMOTE (Minority Class 데이터 2개의 벡터의 중간값 계산) (사용자 질문) Oversampling 하는 방법,Oversampling 하는 방법,Oversampling 방법 : SMOTE (Minority Class 데이터 2개의 벡터의 중간값 계산),
168,valid,"(제공된 정보) 차원의 저주 : 학습 데이터의 차원, 즉 feature 개수가 너무 많아서 학습에 문제가 발생하는 것 (사용자 질문) 차원의 저주가 뭔지 궁금해",차원의 저주가 뭔지 궁금해,"차원의 저주 : 학습 데이터의 차원, 즉 feature 개수가 너무 많아서 학습에 문제가 발생하는 것",
169,valid,"(제공된 정보) 차원의 저주의 문제점 : 계산량, 학습 시간, 메모리 사용량 증가, 성능 감소 (사용자 질문) 차원의 저주는 저주인데 정확히 뭐가 문제야?",차원의 저주는 저주인데 정확히 뭐가 문제야?,"차원의 저주의 문제점 : 계산량, 학습 시간, 메모리 사용량 증가, 성능 감소",
170,valid,(제공된 정보) Decision Tree (의사결정 나무) : 학습 데이터의 feature 조건에 따라 가지치기를 하여 Tree 를 만드는 학습 방식 (사용자 질문) 의사결정 나무가 뭔지 알려줘,의사결정 나무가 뭔지 알려줘,Decision Tree (의사결정 나무) : 학습 데이터의 feature 조건에 따라 가지치기를 하여 Tree 를 만드는 학습 방식,
171,valid,(제공된 정보) Decision Tree (의사결정 나무) : 학습 데이터의 feature 조건에 따라 가지치기를 하여 Tree 를 만드는 학습 방식 (사용자 질문) Decision Tree 가 뭐야?,Decision Tree 가 뭐야?,Decision Tree (의사결정 나무) : 학습 데이터의 feature 조건에 따라 가지치기를 하여 Tree 를 만드는 학습 방식,
172,valid,(제공된 정보) Decision Tree (의사결정 나무) 의 추론 : 입력 데이터가 주어졌을 때 학습된 조건에 따라 판단하는 것을 반복 (사용자 질문) Decision Tree 로 새로운 데이터를 어떻게 예측해?,Decision Tree 로 새로운 데이터를 어떻게 예측해?,Decision Tree (의사결정 나무) 의 추론 : 입력 데이터가 주어졌을 때 학습된 조건에 따라 판단하는 것을 반복,
173,valid,(제공된 정보) Ensemble (앙상블) : 머신러닝에서 여러 알고리즘 또는 모델을 결합하여 학습하는 것 (사용자 질문) 앙상블이 뭐지?,앙상블이 뭐지?,Ensemble (앙상블) : 머신러닝에서 여러 알고리즘 또는 모델을 결합하여 학습하는 것,
174,valid,(제공된 정보) Ensemble (앙상블) 장점 : 여러 개의 모델을 이용하여 단일 모델 이용 시보다 성능 향상 (사용자 질문) 앙상블 하는 이유,앙상블 하는 이유,Ensemble (앙상블) 장점 : 여러 개의 모델을 이용하여 단일 모델 이용 시보다 성능 향상,
175,valid,"(제공된 정보) Ensemble (앙상블) 방법 : Voting (보팅), Bagging (배깅), Boosting (부스팅), Stacking (스태킹) (사용자 질문) 앙상블 방법",앙상블 방법,"Ensemble (앙상블) 방법 : Voting (보팅), Bagging (배깅), Boosting (부스팅), Stacking (스태킹)",
176,valid,"(제공된 정보) Ensemble (앙상블) 방법 : Voting (보팅), Bagging (배깅), Boosting (부스팅), Stacking (스태킹) (사용자 질문) Ensemble 정확히 어떻게 하지",Ensemble 정확히 어떻게 하지,"Ensemble (앙상블) 방법 : Voting (보팅), Bagging (배깅), Boosting (부스팅), Stacking (스태킹)",
177,valid,(제공된 정보) Voting (보팅) : 여러 모델의 예측 결과를 종합하여 최종 결론 도출 (사용자 질문) Voting? 그게 뭐지,Voting? 그게 뭐지,Voting (보팅) : 여러 모델의 예측 결과를 종합하여 최종 결론 도출,
178,valid,(제공된 정보) Voting (보팅) : 여러 모델의 예측 결과를 종합하여 최종 결론 도출 (사용자 질문) 앙상블 중에서 보팅 있잖아 그게 뭐야,앙상블 중에서 보팅 있잖아 그게 뭐야,Voting (보팅) : 여러 모델의 예측 결과를 종합하여 최종 결론 도출,
179,valid,"(제공된 정보) Voting (보팅) 방법 : Hard Voting (다수결 투표), Soft Voting (예측 결과 평균) (사용자 질문) 보팅 방법 구체적으로 알려줘",보팅 방법 구체적으로 알려줘,"Voting (보팅) 방법 : Hard Voting (다수결 투표), Soft Voting (예측 결과 평균)",
180,valid,"(제공된 정보) Bagging (배깅) : 원본 데이터셋에서 랜덤 샘플링된 다수의 데이터셋을 각 모델로 학습, 해당 모델들의 결과 종합 (사용자 질문) 배깅이뭐야",배깅이뭐야,"Bagging (배깅) : 원본 데이터셋에서 랜덤 샘플링된 다수의 데이터셋을 각 모델로 학습, 해당 모델들의 결과 종합",
181,valid,"(제공된 정보) Boosting (부스팅) : 랜덤 샘플링된 데이터셋 여러 개로 여러 개의 모델 학습, 직전 모델이 오답을 한 데이터의 가중치를 높여서 순차 학습 (사용자 질문) 부스팅이 뭐지 그러면",부스팅이 뭐지 그러면,"Boosting (부스팅) : 랜덤 샘플링된 데이터셋 여러 개로 여러 개의 모델 학습, 직전 모델이 오답을 한 데이터의 가중치를 높여서 순차 학습",
182,valid,"(제공된 정보) Stacking (스태킹) : 학습 데이터의 개별 모델들의 예측값을 입력, 실제 출력값을 출력하는 메타 모델을 만들고, 메타 모델 예측값을 최종 예측값으로 사용 (사용자 질문) Stacking 이라고 아주 복잡한 방법인 거 같은데 정확히 알려줘",Stacking 이라고 아주 복잡한 방법인 거 같은데 정확히 알려줘,"Stacking (스태킹) : 학습 데이터의 개별 모델들의 예측값을 입력, 실제 출력값을 출력하는 메타 모델을 만들고, 메타 모델 예측값을 최종 예측값으로 사용",
183,valid,(제공된 정보) Gaussian Mixture (가우시안 혼합) : 가우시안 분포 (정규분포) 의 혼합을 통해 데이터를 근사하는 머신러닝 알고리즘 (사용자 질문) 가우시안 혼합? 그게 뭐야?,가우시안 혼합? 그게 뭐야?,Gaussian Mixture (가우시안 혼합) : 가우시안 분포 (정규분포) 의 혼합을 통해 데이터를 근사하는 머신러닝 알고리즘,
184,valid,(제공된 정보) Gaussian Mixture (가우시안 혼합) : 가우시안 분포 (정규분포) 의 혼합을 통해 데이터를 근사하는 머신러닝 알고리즘 (사용자 질문) Gaussian Mixture 어려운 것 같은데 뭐야?,Gaussian Mixture 어려운 것 같은데 뭐야?,Gaussian Mixture (가우시안 혼합) : 가우시안 분포 (정규분포) 의 혼합을 통해 데이터를 근사하는 머신러닝 알고리즘,
185,valid,"(제공된 정보) K-means Clustering : 비지도학습 방법으로, 데이터를 K개의 클러스터 (집단) 으로 나누는 방법 (사용자 질문) K-means Clustering 너 알지?",K-means Clustering 너 알지?,"K-means Clustering : 비지도학습 방법으로, 데이터를 K개의 클러스터 (집단) 으로 나누는 방법",
186,valid,"(제공된 정보) K-means Clustering 방법 : feature space 에서 K개의 점을 임의 지정 후, 각 data point 를 가장 가까운 점에 할당 -> K개의 각 점을 매칭되는 data point 의 값으로 갱신을 수렴할 때까지 반복 (사용자 질문) K-means Clustering 방법",K-means Clustering 방법,"K-means Clustering 방법 : feature space 에서 K개의 점을 임의 지정 후, 각 data point 를 가장 가까운 점에 할당 -> K개의 각 점을 매칭되는 data point 의 값으로 갱신을 수렴할 때까지 반복",
187,valid,"(제공된 정보) kNN (k-Nearest-Neighbor) : 어떤 data point 를 분류할 때, 가장 가까운 k개의 data point 의 Class 값 중 빈도가 가장 큰 Class 로 예측 (사용자 질문) KNN 알고리즘 알려줘",KNN 알고리즘 알려줘,"kNN (k-Nearest-Neighbor) : 어떤 data point 를 분류할 때, 가장 가까운 k개의 data point 의 Class 값 중 빈도가 가장 큰 Class 로 예측",
188,valid,"(제공된 정보) kNN (k-Nearest-Neighbor) : 어떤 data point 를 분류할 때, 가장 가까운 k개의 data point 의 Class 값 중 빈도가 가장 큰 Class 로 예측 (사용자 질문) k Nearest Neighbor 가 도대체 어떤 알고리즘이야?",k Nearest Neighbor 가 도대체 어떤 알고리즘이야?,"kNN (k-Nearest-Neighbor) : 어떤 data point 를 분류할 때, 가장 가까운 k개의 data point 의 Class 값 중 빈도가 가장 큰 Class 로 예측",
189,valid,"(제공된 정보) 지도학습, 비지도학습, 강화학습 : 지도학습은 입력값 및 출력값을 학습 데이터로 하며, 출력값 (label) 필요 | 비지도학습은 출력값 (label) 이 없는 방식의 학습 | 강화학습은 AI 모델이 환경에서 어떤 행동을 하고, 그 보상을 받아서 보상을 최대화하는 방식의 학습 (사용자 질문) 지도학습 강화학습 비지도학습 이런게 뭐지",지도학습 강화학습 비지도학습 이런게 뭐지,"지도학습, 비지도학습, 강화학습 : 지도학습은 입력값 및 출력값을 학습 데이터로 하며, 출력값 (label) 필요 | 비지도학습은 출력값 (label) 이 없는 방식의 학습 | 강화학습은 AI 모델이 환경에서 어떤 행동을 하고, 그 보상을 받아서 보상을 최대화하는 방식의 학습",
190,valid,"(제공된 정보) 지도학습, 비지도학습, 강화학습 : 지도학습은 입력값 및 출력값을 학습 데이터로 하며, 출력값 (label) 필요 | 비지도학습은 출력값 (label) 이 없는 방식의 학습 | 강화학습은 AI 모델이 환경에서 어떤 행동을 하고, 그 보상을 받아서 보상을 최대화하는 방식의 학습 (사용자 질문) 머신러닝 방법 종류 알려줘",머신러닝 방법 종류 알려줘,"지도학습, 비지도학습, 강화학습 : 지도학습은 입력값 및 출력값을 학습 데이터로 하며, 출력값 (label) 필요 | 비지도학습은 출력값 (label) 이 없는 방식의 학습 | 강화학습은 AI 모델이 환경에서 어떤 행동을 하고, 그 보상을 받아서 보상을 최대화하는 방식의 학습",
191,valid,"(제공된 정보) 지도학습, 비지도학습, 강화학습 : 지도학습은 입력값 및 출력값을 학습 데이터로 하며, 출력값 (label) 필요 | 비지도학습은 출력값 (label) 이 없는 방식의 학습 | 강화학습은 AI 모델이 환경에서 어떤 행동을 하고, 그 보상을 받아서 보상을 최대화하는 방식의 학습 (사용자 질문) 지도학습? 강화학습? 이게 도대체 뭐야? 처음 들어 보는데",지도학습? 강화학습? 이게 도대체 뭐야? 처음 들어 보는데,"지도학습, 비지도학습, 강화학습 : 지도학습은 입력값 및 출력값을 학습 데이터로 하며, 출력값 (label) 필요 | 비지도학습은 출력값 (label) 이 없는 방식의 학습 | 강화학습은 AI 모델이 환경에서 어떤 행동을 하고, 그 보상을 받아서 보상을 최대화하는 방식의 학습",
192,valid,"(제공된 정보) 지도학습과 비지도학습의 차이 : 지도학습은 모델이 입력 값에 대해 특정 출력을 하도록 학습시키기 위한 출력값 (label) 이 있지만, 비지도학습은 출력값이 없음 (사용자 질문) 지도학습이랑 비지도랑 뭐가 달라 그러면?",지도학습이랑 비지도랑 뭐가 달라 그러면?,"지도학습과 비지도학습의 차이 : 지도학습은 모델이 입력 값에 대해 특정 출력을 하도록 학습시키기 위한 출력값 (label) 이 있지만, 비지도학습은 출력값이 없음",
193,valid,"(제공된 정보) Classification (분류) 및 Regression (회귀) : Classification 문제는 대상의 Class 를 분류 (예: 개, 고양이, 뱀) 하는 것 | Regression 문제는 연속적인 숫자 값 (예: 강수량) 을 예측하는 것 (사용자 질문) 머신러닝 문제에는 뭐가 있지?",머신러닝 문제에는 뭐가 있지?,"Classification (분류) 및 Regression (회귀) : Classification 문제는 대상의 Class 를 분류 (예: 개, 고양이, 뱀) 하는 것 | Regression 문제는 연속적인 숫자 값 (예: 강수량) 을 예측하는 것",
